Title,Price,Rating,Review,Availability,Material,Color,Style,Brand,Item Dimension L*W*H,Pattern,Item Weight,Age Range,Capacity,Discription,URL,,,
The Legend of Zelda Hylian Shield Gray Insulated Lunchbox Cooler Bag,None,4.9 out of 5 stars,316 ratings,None,100% P/U,Blue,None,Bioworld,11.97 x 9.84 x 2.28 inches,None, 7.2 Ounces,Adult,None," Make sure this fitsby entering your model number.Officially Licensed Product9"" x 3"" x11""Full Zip100% P/UDetailed Raised design",https://www.amazon.com/Legend-Hylian-Shield-Insulated-Lunchbox/dp/B010JJF204/ref=sr_1_1?dchild=1&keywords=Lunch+Bag&qid=1628206243&refinements=p_85%3A2470955011&rnid=2470954011&rps=1&s=home-garden&sr=1-1,,,
PJ Masks Ready For Action Dual Compartment Insulated Lunch Bag Tote,$9.99,4.9 out of 5 stars,307 ratings,None,Polyester,Multicolor,None,Accessory Innovations,10 x 8 x 5 inches,None, 5.93 Ounces,Kid,None, Make sure this fitsby entering your model number.Officially Licensed PJ Masks ProductDual compartment insulated lunch box with Catboy Owlette and Gekko on the front and side panelsPadded top carrying handle and zipper closures for easy storage and crush proof lunchesReduce waste and save money by packing your lunches in a reusable containerTreat yourself or make this PJ Masks lunch box the perfect gift for a fan!,https://www.amazon.com/Masks-Ready-Action-Compartment-Insulated/dp/B08638QHTT/ref=sr_1_2?dchild=1&keywords=Lunch+Bag&qid=1628206243&refinements=p_85%3A2470955011&rnid=2470954011&rps=1&s=home-garden&sr=1-2,,,
Womens Lunch BagsInsulated Lunch Box Cooler Thermal Bag with Detachable Shoulder Strap Leopard,None,4.9 out of 5 stars,191 ratings,None,Pvc,Leopard,None,Castura,None,Animal Print,None,Adult,None, Make sure this fitsby entering your model number.Small tote bag but efficiency ---- Size: 11L x 6W x 8H incheswith 1 front pocket1 back pocket2 side pocket and 1 inner mesh pocketPortable to carry ---- functional lunch bags that comes equipped with a tote handle and detachable shoulder strap.The shoulder strap can be adjusted to any length you need to allow you hand-free and can be detached if you do not need.Keep food warm/cold for hours ---- Equipped with thermal PEVA lining.Our insulated lunch bag will keep your food/drinks at optimal temperature so you can always recharge with warm tasty food and cold drinks!Food safe lunch tote ---- All bags are made FREE from PVC BPA phthalate and lead materials and have experienced rigorous quality control tests.Insulated lunch box for carrying food snacks lunch to school office work and on the go. This durable reusable lunch bag is uniquely built to meet all your daily lunch meal prep or snacking need.,https://www.amazon.com/Insulated-Thermal-Detachable-Shoulder-Leopard/dp/B08LD8YF7T/ref=sr_1_3?dchild=1&keywords=Lunch+Bag&qid=1628206243&refinements=p_85%3A2470955011&rnid=2470954011&rps=1&s=home-garden&sr=1-3,,,
Dino Scandinavian Style Lunch Bag for Boys GirlsDinosaur Children Reusable Lunch Bags Lunch Box Container with Detachable Shoulder StrapInsulated Lunch Coolers for School Work,$20.99,4.9 out of 5 stars,173 ratings,None,Neoprene,Dino Scandinavian,Cute,OREZI,None,Dinosaur,None,Adult,None, Make sure this fitsby entering your model number.Material: High-quality leakproof Oxford and easy-to-clean food-grade aluminum filmsturdy and lightweight it will keep your food cold / warm / fresh for about 6 hoursSize: 11.4x7.1x9.5 inches/29x18x24cm this cute insulated lunch bags are roomy enough to hold fruits food containers sandwich chips and other snacks perfect for school travel picnic office yoga outdoor usingStructre:The lunchbox bag have 1 main zipper pocket to keep you food and drinks warm or fresh 1 front big pocket put Tableware or keys cards phones and so on. Is very easy to take anywhere like go Day Trips Beach and Sporting.Adjustable shoulder Strap:Our lunch tote bag has sturdy hand straps and equipped with a detachable and adjustable shoulder strap(drop 13.8-23.6 inches)  which can be carried out in a variety of ways. It is very light foldable and very convenient to carry around.Gurantee:The best product and service for you! You can get the refund for any unpleasant reasons. And we will be glad to receive Suggestions from you too,https://www.amazon.com/Scandinavian-Dinosaur-Container-Detachable-Insulated/dp/B08D8Q82F7/ref=sr_1_4?dchild=1&keywords=Lunch+Bag&qid=1628206243&refinements=p_85%3A2470955011&rnid=2470954011&rps=1&s=home-garden&sr=1-4,,,
ZOISOKA portable leak-proof lunch bag waterproof large-capacity lunch handbag insulated heat insulation sunflower insulation bag,None,4.9 out of 5 stars,157 ratings,None,Oxford cloth,Black,None,ZOISOKA,None,None,None,None,330 Milliliters, Make sure this fitsby entering your model number.INSULATED & STURDY MATERIAL - Made of 600D durable Oxford cloth rigid bottom top metal wire frame and stability feet on the bottom help give the basket structure to stay open and upright.8mm thick PE foam padding and PU insulation material can remains your foods at constant temperature for hours.during shopping trips camping picnics road trips parties bringing dinner home or taking lunch to work. We include premium 3mm insulation & a sturdy aluminum interior.LEAKPROOF INTERIOR - Heat-welded technology make the interior of the lunch bag leakproof and easy to clean never worry about soup or drinks in lento box seeping through your lunch bag and making a mess on the table. easy to clean and the inside is only wiped with a paper towel .LARGE CAPACITY - Large bag size 10.63 * 7.87 * 10.63 inches (L x W x H) roomy space can easily store all you needs for your lunch or picnic. 10L large capacity is enough to hold up to 20 tins of sodas (330ml).Stands upright when packing. Collapsible and foldable for easy storage. Front pocket for cell phones keys grocery lists. Wrap around handles and bottom supports for durability.PORTABLE DESIGN - The adjustable shoulder strap strong grab handle also facilitates you to take this lunch bag out for office or gym and outdoors. Double zippers design for easy access. You can store small things in the front pocket.Premium handles and a long shoulder strap give multiple ways for toting. totes fold flat to store in your kitchen pantry or car trunk.100% MONEY BACK GUARANTEE - If for any reason you are unhappy with your purchase in 30 day we will refund your money no questions asked. Customer Service. Buy with confidence and thanks for being a Prized ZOISOKA supporter!,https://www.amazon.com/ZOISOKA-leak-proof-waterproof-large-capacity-insulation/dp/B0881PZF27/ref=sr_1_5?dchild=1&keywords=Lunch+Bag&qid=1628206243&refinements=p_85%3A2470955011&rnid=2470954011&rps=1&s=home-garden&sr=1-5,,,
Vera Bradley Women's Performance Twill Lunch Bunch Lunch Bag,$40.00,4.9 out of 5 stars,132 ratings,In stock soon.,Polyester,Dover Mauve,Performance Twill Lunch Bunch Lunch Bag,Vera Bradley,None,None,None,Adult,5 Liters,100% PolyesterImportedPERFORMANCE TWILL -- This weather-friendly water-repellent fabric is durable & lightweight for everyday useQUILTED INSULATION -- Vera Bradley's colorful & lightweight Lunch Bunch gets an upgrade with an insulated food safe PEVA lined interior & slip pocket for ice packs allowing your food to keep a steady temperature until it's time to eatNEVER GO HUNGRY -- Whether you need to pack a lunch for your little girl’s field trip bring a small meal for your break between classes or eating at the office the Lunch Bunch is the perfect for every snackPUT YOUR NAME ON IT -- Our Lunch Bunch comes with an ID window for you to visibly display your namePERFECTLY SIZED -- The Vera Bradley Lunch Bunch measures 9 inches high 8 inches wide & 4 inches deep with a 2 inch handle & an exterior ID window for personalized style & security,https://www.amazon.com/Vera-Bradley-Performance-Twill-Bunch/dp/B08MB7JYPT/ref=sr_1_7?dchild=1&keywords=Lunch+Bag&qid=1628206243&refinements=p_85%3A2470955011&rnid=2470954011&rps=1&s=home-garden&sr=1-7,,,
BLUEFAIRY Kids Insulated Lunch Box Bags for Girls Camouflage Lunchbox Lunchbags for Boys for School (Red Camo),None,4.9 out of 5 stars,107 ratings,None,None,Red Camo,None,BLUEFAIRY,None,None,None,Kid,None, Make sure this fitsby entering your model number.Perfect Size: 10L x 4H x 8W (inches) spacious and fits into backpackEasy to clean:Sturdy fabric construction and waterproof liningstain Resistantleakproof and easy to wipe clean.Easy to use:top grab-handleinterior mesh pouch for ice pack and front zipped pocket for small items like spoonnapkin.Keep your food fresh:Insulated with leak-proof lining and thick foamkeep the food cold/warm for hours.Manufacturer recommended age: 3-15 years,https://www.amazon.com/BLUEFAIRY-Insulated-Camouflage-Lunchbags-School/dp/B07V217X3H/ref=sr_1_8?dchild=1&keywords=Lunch+Bag&qid=1628206243&refinements=p_85%3A2470955011&rnid=2470954011&rps=1&s=home-garden&sr=1-8,,,
Insulated Lunch Bag for Women Men VESKYAO Leakproof Cooler Lunch Box Fresh Reusable Tote Bag with Adjustable Shoulder Strap for Office Work School Picnic Beach 12-Can(9L),None,4.9 out of 5 stars,96 ratings,None,Cotton,Gray,Classic,VESKYAO,None,None,None,Adult,9 Liters, Make sure this fitsby entering your model number.【LARGE CAPACITY】 The lunch bag ( 15.2 x 10.98 x 2.95 inches) is designed to maximize storage efficiency with 1 front zipper pocket 1 internal mesh pocketand 2 side mesh pockets.The front pocket can carry personal items the two side pockets are perfect for you to carry water bottles and an internal mesh pocket is used to store sharp items in case the inner layer is scratched.【LONG-TERM HEAT PRESERVATION】 The lunch bag has 5mm pearl cotton which can keep food or beverages warm for 4-5 hours. When you put ice packs or crushed ice in the heat preservation bag it will keep the beverages cool for longer. It is a good helper for your picnic and worksuitable for men women children adults【DIRTY-RESISTANT AND DURABLE】 three-layer lunch bag the outer layer is made of high-quality tear-resistant waterproof Oxford fabric heavy metal zipper main pressure point reinforcement design durable and durable in daily activities the middle layer is pearl cotton and the inner layer is lined with an upgraded version Leak-proof and waterproof aluminum foil better heat insulation not easy to melt easier to clean【LARGE OPENING AND PORTABILITY】 The large opening design makes it easy to retrieve items. Even if you put a lot of things you can tell at a glance. Classic adult gray appearance brown handle and detachable/adjustable shoulder strap. You can carry it in three ways: crossbody shoulder bag and handbag which can be customized according to your different needs.【12 MONTHS WARRANTY】 if there is any leakage please contact us immediately we will replace it for you free of charge，12 months warranty service policy promise. We are 100% dedicated to your complete satisfaction it will be a great festival gift for men and wowen,https://www.amazon.com/Insulated-VESKYAO-Leakproof-Reusable-Adjustable/dp/B08ZS9BZQG/ref=sr_1_9?dchild=1&keywords=Lunch+Bag&qid=1628206243&refinements=p_85%3A2470955011&rnid=2470954011&rps=1&s=home-garden&sr=1-9,,,
Vera Bradley womens Signature Cotton Bunch Lunch Bag Bonbon Medallion one size,$33.23,4.9 out of 5 stars,75 ratings,In Stock.,Cotton,Itsy Ditsy,Signature Cotton Lunch Bunch Lunch Bag,Vera Bradley,4 x 8 x 9 inches,None, 6 Ounces,Adult,5 Liters, Make sure this fitsby entering your model number.100% CottonImportedMACHINE WASHABLE SIGNATURE COTTON -- The fabric you know & love our quilted cotton is lightweight yet durable & comes in a variety of colorful patternsCHIC & ON-THE-GO -- From picnics in the park to a day at the beach zip up your lunch & a few drinks in the spacious main compartment - keeping you fueled & hydrated all day longQUILTED INSULATION -- Vera Bradley's classic quilted fabric gets an upgrade with an insulated PEVA lined interior & slip pocket for ice packs allowing your food to keep a steady temperature until it's time to eatPUT YOUR NAME ON IT -- Our Lunch Bunch comes with an ID window for you to visibly display your namePERFECTLY SIZED -- The Lunch Bunch measures 9 inches high 8 inches wide & 4 inches deep with a 3 inch handle & an exterior ID window for personalized style & security,https://www.amazon.com/Vera-Bradley-Signature-Cotton-Bunch/dp/B084DVZ3GF/ref=sr_1_10?dchild=1&keywords=Lunch+Bag&qid=1628206243&refinements=p_85%3A2470955011&rnid=2470954011&rps=1&s=home-garden&sr=1-10,,,
ALAZA Red Rose Flower Floral Insulated Lunch Bag Reusable Cooler Bags with Shoulder Strap for Women Men Adults 19-Can (12.5L),None,4.9 out of 5 stars,73 ratings,None,Oxford cloth,Rose,None,ALAZA,None,Floral,None,Adult,None, Make sure this fitsby entering your model number.Size: 29 x 18 x 24cm ( 11.4 x 7.1 x 9.5in ) (12.5L) - holds 19 cans / 6-7 containersMaterial: 300D Oxford cloth + braided tape + high-quality aluminum filmStructure: A main compartment with a high-quality thermal insulation aluminum film inside which plays a great role in heat preservation. The front pocket for small items such as towels tableware paper napkin or mobile phones. The long adjustable strap will meet your needs to shoulder it.Printing Technology: High-tech digital printing technology will presents vivid and beautiful patterns without fading which show your own style and personality.Durable & Heavy Duty: The exterior of lunch bag is constructed out of 300D dirt-proof Oxford fabric for durability and easy cleaning. Strong handles and heavy duty nylon connected by dense stitching that make the bag extremely durable proud to carry your lunch.,https://www.amazon.com/ALAZA-Flower-Insulated-Reusable-Shoulder/dp/B0856VM63K/ref=sr_1_11?dchild=1&keywords=Lunch+Bag&qid=1628206243&refinements=p_85%3A2470955011&rnid=2470954011&rps=1&s=home-garden&sr=1-11,,,
LOKASS Lunch Bag Insulated Lunch Box Wide-Open Lunch Tote Bag Large Drinks Holder Durable Nylon Thermal Snacks Organizer for Women Men Adults College Work Picnic Hiking Beach FishingGrey,None,4.8 out of 5 stars,15799 ratings,None,Nylon,Gray,Casual,LOKASS,10 x 6 x 11 inches,Solid, 12.63 Ounces,Adult,10 Liters," Make sure this fitsby entering your model number.Upgraded Lining - The lining is made of Aluminum foil that won't melt easily when the bag hold something hot.Dimensions - 10.5""L x 6""W x 11""H. Lunch bag looks small but the main compartment is large capacity and can fit 2 pcs 9*5*3 inch lunch containers and 2 bottle of 330ml drinks. You can store your sandwichs salad snacks drinks and fruits in one bag.It can fit all your lunch need.Wide Open Design - Top of the bag can be opened up to 10""L x 6""W by dual zipper closure that means your lunch container can be put into the bag and taken out of the bag HORIZONTALLY. Wide open design is for easy accessing and it can prevent the liquid from leaking out of the container and soiling inside of the bag. Save your cleaning time.Long-term Preservation - Lining is made of insulated material. Insulated lining can keep foods and drinks warm & fresh for 6.5 hours and it is easy to wipe clean. Besidesyou could put your foods and fruits into the bag directly. Built-in foam provides great protection to your containers foods and drinks.Extremely Durable & Heavy Duty - The report of load-shaking test shows that the bag can bear more than 5000 times irregular machine shaking continuously when the lunch bag loaded 22lb(10kg). Strong linen handles and heavy duty nylon connect by dense stitching that make the bag extremely durableproud to carry your lunch.",https://www.amazon.com/LOKASS-Insulated-Wide-Open-Durable-Organizer/dp/B07JVH4CQ2/ref=sr_1_12?dchild=1&keywords=Lunch+Bag&qid=1628206243&refinements=p_85%3A2470955011&rnid=2470954011&rps=1&s=home-garden&sr=1-12,,,
LOKASS Lunch Bag Cooler Bag Women Tote Bag Insulated Lunch Box Water-resistant Thermal Lunch Bag Soft Liner Lunch Bags for women /Picnic/Boating/Beach/Fishing/Work (Peony),None,4.8 out of 5 stars,13893 ratings,None,Fabric,A-Blue,Casual & Stylish,LOKASS,None,Floral,None,Adult,8 Liters, Make sure this fitsby entering your model number.Perfect Size - Dimension is 11.5x6.5x8.2 in(L*W*H). Compact lunch bag looks small but can fit 2 pcs 8*5*2 in & 1 pcs 8*6*2.5 in lunch container & 3 cans of cola. Cute lunch bag 100% can fit one person’s need.Stylish Design - Lunch tote design with floral pattern. You can take this fashionable lunch bag to work or college. Especially design for women girls and ladies a great gift choice.Upgraded Material - Made of high quality canvas that has a waterproof coating on surface. Thick EVA lining that is easy to clean can keep food warm and fresh for 6 hours. 5mm padding provides better protection and insulation.Durable & Heavy Duty - This insulated lunch bag with well-made crafts can withstand 5000 times machine shaking when lunch box loaded 11lb(5kg) items. Metal zipper won’t break easily.Structure - Adult lunch bag has 1 main zipper compartment to carry lunch snacks drinks and fruits 1 front pocket for tableware keys phones etc. Dual handles for easy carry.Reusable & Lightweight & Portable lunch bag.,https://www.amazon.com/LOKASS-Insulated-Water-resistant-Thermal-Boating/dp/B07GD9XYR8/ref=sr_1_13?dchild=1&keywords=Lunch+Bag&qid=1628206243&refinements=p_85%3A2470955011&rnid=2470954011&rps=1&s=home-garden&sr=1-13,,,
Lunch Bags for Women Insulated Thermal Lunch Tote Bag Durable Large Lunch Box Container Drinks Holder for Adults Men Work College Picnic Beach Park Grey,None,4.8 out of 5 stars,7213 ratings,None,Standard Size,Gray,Modern,EASYFUN,12 x 7.5 x 6 inches,Solid, 11.36 Ounces,Adult,None, Make sure this fitsby entering your model number.✅Premium Material-The lunch bag is made of durable oxford cloth and BPA-Free aluminum foil it can hold something hot or ice.✅Keep Fresh-The lining aluminum foil is an insulating material it can preserve food or drinks fresh and cool about 6-8 hours.✅EASYFUN Design-The unique design filling with you in mind. Two small front pockets can be used as daily kits containers like keys and tissues another back pocket with zipper can store something important like cards.✅All Day Needs- The lunch bag has been upgraded to a perfect size: 12 x 6 x 10 inch it can easily store 3 pcs L size lunch containers and 2 bottles of drinks and 4 apples to meet your daily needs.✅Excellent Service-Each EASYFUN lunch bag is covered with a lifetime warranty. If you have any questions about the product please feel free to email us we will promptly reply to you in 12 hours.,https://www.amazon.com/Lunch-Women-Insulated-Fashionable-Large/dp/B07R4SPJ2G/ref=sr_1_14?dchild=1&keywords=Lunch+Bag&qid=1628206243&refinements=p_85%3A2470955011&rnid=2470954011&rps=1&s=home-garden&sr=1-14,,,
adidas Santiago Insulated Lunch Bag,$18.75,4.8 out of 5 stars,5160 ratings,In Stock.,None,Black/White,Santiago Insulated Lunch Bag,Adidas,5 x 5 x 0.7 inches,Solid, 6.4 Ounces,Kids,Adult,None,100% PolyesterImportedHand WashLiner in main pocket to keep goods cold.Mesh on back and small pocket in front.Linear adidas front logo.Foam padded handle.,https://www.amazon.com/adidas-Santiago-Lunch-Black-White/dp/B07KDSWWXK/ref=sr_1_15?dchild=1&keywords=Lunch+Bag&qid=1628206243&refinements=p_85%3A2470955011&rnid=2470954011&rps=1&s=home-garden&sr=1-15,,
BUILT Gourmet Getaway Soft Neoprene Lunch Tote Bag - Lightweight Insulated and Reusable Black LB31-BLK,None,4.8 out of 5 stars,3592 ratings,Available to ship in 1-2 days.,Neoprene,Black,Gourmet Getaway,BUILT,11.5 x 6.8 x 12.5 inches,Solid, 6.4 Ounces,None,None, Make sure this fitsby entering your model number.MACHINE WASHABLE: This mid sized stretchy neoprene lunch tote is made from machine washable neoprene; No need to worry about accidents and spills inside or outside your tote because you can easily machine wash it on cold and let it air dryNEOPRENE INSULATING MATERIAL: Keeps food cold (or warm) for up to 4 hours depending on the content and outside temperature; The cooler the contents the longer they will stay coldDURABLE & REUSABLE: This lunch bag is reusable and extremely durable stain tear and water resistant while being lightweight so it doesn’t add to your loadEXPANDABLE & STORES FLAT: The neoprene material allows the lunch tote to expand to fit a variety of food and drink containers with a flat bottom to sit upright. This tote packs more than you would think but is still able to fold flat to take up less spaceSECURE ZIPPER CLOSURE & EASY TO CARRY: This lunch tote has a smooth secure zipper closure to keep your lunch inside when you are on the go; The soft grip neoprene handles make it easy to carry; Neoprene stretches for maximum comfort on your fingers,https://www.amazon.com/LB31-BLK-Neoprene-Bag-Lightweight-Insulated-Reusable/dp/B000ECE5WS/ref=sr_1_16?dchild=1&keywords=Lunch+Bag&qid=1628206243&refinements=p_85%3A2470955011&rnid=2470954011&rps=1&s=home-garden&sr=1-16,,,
LOKASS Lunch Bags for Women Double Deck Insulated Lunch Box Large Cooler Tote Bag with Removable Shoulder Strap Wide Open Thermal Meal Prep Lunch Organizer Box for Adults/Work/Outdoor Black Peony,None,4.8 out of 5 stars,3324 ratings,None,Fabric,Black Peony,Modern,LOKASS,None,Floral,None,Adult,15 Liters, Make sure this fitsby entering your model number.Large Capacity Double Deck Lunch Bag -- Dimension: 10.2 x 7.9 x 11.4 inches (L x W x H). Two isolated compartments allows you to pack cold drinks and hot food separately. Its wide opening design offers an easy access to food inside with a 2-way dual zipper closure. Ideal for adult men women to pack large amounts of food to work and outdoor activities.Double Deck Insulated -- Two sections that keep cold and warm items separated. You could keep food hot on up deck and keep drinks cool on down deck. No worry of mixing hot and cold food any more. Bottom section is leakproof design no worry of spills and leaks anymore. The soft PEVA lining is water resistant and stain resistant. Easy for you to load and unload with the wide open design. If sauce spills inside just a wipe with damp cloth and it is good as new.Durable Structure -- (1)Exterior made of heavy duty Nylon fabric water resistant & scratch resistant and keep its shape well. (2)Interior is thick foam padding and soft PEVA insulated preserve food cold or warm for 6 hours. (3)Top handle and side shoulder strap with reinforced stitching ensuring maximum durability. (4)PU leather Bottom with 4pcs feet makes this lunch bag stand alone by itself.Powerful Organization -- This thermal tote lunch bag features 2-ways zipper access wide-open main compartments. Upper compartment 9.8 x 7.8 x 5.5 inch can pack 4-5pcs apples many snacks and more. Down compartment 9.8 x 7.8 x 3.9 inch can fit 2pcs 9x5.9x3 inch lunch boxes and 2 cans 330ml cola. 2 front + 2 side + 2 back pockets can put utensils napkin keys bus cards etc. Powerful organization ability to carry more foods easily to improve your to-go daily life.Multiple Carrying Ways -- Soft handle for easy tote. It also comes with a detachable shoulder strap that adjustable from 29 inch to 52 inch offering a free of hands carrying option. This bag can be used as a lunch bag picnic bag snack bag cooler bag diaper bag and a shopping bag to supermarket so versatile for men and women packing food and drink to work campus gym outdoor etc.,https://www.amazon.com/LOKASS-Insulated-Removable-Shoulder-Organizer/dp/B07SQ7DJJQ/ref=sr_1_17?dchild=1&keywords=Lunch+Bag&qid=1628206243&refinements=p_85%3A2470955011&rnid=2470954011&rps=1&s=home-garden&sr=1-17,,,
