Title,Price,Rating,Review,Availability,Material,Color,Style,Brand,Item Dimension L*W*H,Pattern,Item Weight,Age Range,Capacity,Discription,URL,,,
"Fit + Fresh Cool Coolers 7 x 5"" Soft Ice for Injuries Lunch Box Coolers Beach Bags and Picnic Baskets Berry Geo and Navy 2 Pack",$9.99,4.7 out of 5 stars,277 ratings,In Stock.,Nylon,Berry Geo and Navy,None,Fit & Fresh,None,None,None,Adult,None, Make sure this fitsby entering your model number.NylonVERSATILE DESIGN - Designed to have multiple uses these extra soft ice packs can be used for small injuries or to keep your food or drinks fresh for long periods of time. The versatile design allows you to pack them on the bottom and/or sides of your lunch bag or cooler. Tip: use several ice packs for greater cooling power.EXTRA SOFT ICE PACK - Designed to be flexible when frozen keep your items cold for hours. These soft ice packs are perfectly designed to mold around bottles and containers. Perfect for the pumping on-the-go mom.LONG-LASTING - These reusable non-toxic ice packs are designed to last long so you can head out knowing that what you pack will stay cool and fresh until you are ready to eat. For maximum cooling power freeze the ice packs the night before use and add 2 -3 icepacks per lunch box.SWEAT PROOF NYLON FABRIC - Featuring a smooth high quality nylon fabric that resistant to tears and rips. Sweat-proof and will remain free from condensation making it perfect for small injuries. Place this ice pack in lunch bags on injuries coolers beach bags or picnic bags without the worry of moisture soiling your items! Hand wash only do not microwave.DESIGN BY WOMEN FOR WOMEN & THEIR FAMILIES - Based in Providence RI Fit + Fresh prides itself on creating functional and distinctive styles for men women and children. Creating a line of fashionable stylish reusable lunch bags and accessories that have long lasting durability making it perfect for anyone who is always on-the-go!,https://www.amazon.com/Fit-Fresh-Coolers-Injuries-Baskets/dp/B08QQ93ZXR/ref=pd_rhf_se_s_pd_crcd_6/142-4042136-0822045?pd_rd_w=M1YHN&pf_rd_p=ecb2692f-0365-4eca-a102-58ef51a608ce&pf_rd_r=MH3RKNFNEBJX04TB99QN&pd_rd_r=73a49412-febf-4479-beee-a6b4903736ac&pd_rd_wg=nCuFC&pd_rd_i=B08QQ93ZXR&psc=1,,,
Sistema To Go Collection 1.18 Oz. Salad Dressing Containers Pink/Green/Blue/Purple 4 Pack BPA Free Reusable,$12.74,4.6 out of 5 stars,11853 ratings,In Stock.,None,None,None,None,None,None,None,None,None, Make sure this fitsby entering your model number.Small containers ideal for keeping salad dressings separate until you're ready to eatScrew-top lids seal to keep contents containedGreat for back to school lunch leftovers and moreBPA-free plasticTop-rack dishwasher-safe; Fridge- and freezer-safe; Microwave-safe without lidsIncludes four 1.18-ounce. round plastic containersImported,https://www.amazon.com/Sistema-Collection-Dressing-Container-Purple/dp/B00BG4DH90/ref=pd_rhf_se_s_pd_crcd_7/142-4042136-0822045?pd_rd_w=M1YHN&pf_rd_p=ecb2692f-0365-4eca-a102-58ef51a608ce&pf_rd_r=MH3RKNFNEBJX04TB99QN&pd_rd_r=73a49412-febf-4479-beee-a6b4903736ac&pd_rd_wg=nCuFC&pd_rd_i=B00BG4DH90&psc=1,,,
Sistema To Go Collection Mini Bites Small Food Storage Containers 4.39 oz./130 mL Pink/Green/Blue 3 Count,$5.49,4.8 out of 5 stars,6869 ratings,In Stock.,None,None,None,None,None,None,None,None,None, Make sure this fitsby entering your model number.Small food storage container ideal for packing nuts candies sauces and moreScrew-top lids help keep food fresher for longer100% virgin plastic; BPA- and phthalate-freeCompact stackable design for efficient storageDishwasher-safe on the top rack; microwave-safe without lid; fridge- and freezer-safe,https://www.amazon.com/Sistema-Collection-Bites-Storage-Containers/dp/B00Z9C4CT4/ref=pd_rhf_se_s_gcx-rhf_1/142-4042136-0822045?pd_rd_w=L0QYs&pf_rd_p=2ae4ccb1-7034-4114-8654-5ba995870d70&pf_rd_r=J5K2ZGC6SD98PYBTD7M9&pd_rd_r=da95297f-8ba5-47e3-a9de-d0319ff1b94d&pd_rd_wg=hS7ZW&pd_rd_i=B00Z9C4CT4&psc=1,,,
THERMOS FUNTAINER 12 Ounce Stainless Steel Vacuum Insulated Kids Straw Bottle Pink,$14.99,4.8 out of 5 stars,19304 ratings,In Stock.,None,None,None,None,None,None,None,None,None, Make sure this fitsby entering your model number.THERMOS vacuum insulation technology for maximum temperature retention not for use with hot liquidsDurable stainless steel interior and exteriorHygienic push button lid with pop-up straw and integrated carry handleKeeps cold 12 hours12 ounce capacity; hand washing recommended,https://www.amazon.com/Thermos-Funtainer-Ounce-Bottle-Pink/dp/B00DAPQT3O/ref=pd_rhf_se_s_gcx-rhf_2/142-4042136-0822045?pd_rd_w=L0QYs&pf_rd_p=2ae4ccb1-7034-4114-8654-5ba995870d70&pf_rd_r=J5K2ZGC6SD98PYBTD7M9&pd_rd_r=da95297f-8ba5-47e3-a9de-d0319ff1b94d&pd_rd_wg=hS7ZW&pd_rd_i=B00DAPQT3O&psc=1,,,
TICONDEROGA Pencils Wood-Cased Pre-Sharpened Graphite #2 HB Soft Yellow 30-Pack (13830),$5.79,4.9 out of 5 stars,40590 ratings,In Stock.,Wood, Graphite,Yellow,None,Ticonderoga,None,None,None,None,None, Make sure this fitsby entering your model number.Made with premium wood from responsibly sourced forestsPre-sharpened tip allows immediate use directly from boxExclusive graphite-core formula provides extra-smooth laydownNontoxic design allows safe use by writers of all ages,https://www.amazon.com/Ticonderoga-Wood-Cased-Graphite-Pre-Sharpened-13830/dp/B006CSPZK4/ref=pd_rhf_se_s_gcx-rhf_3/142-4042136-0822045?pd_rd_w=L0QYs&pf_rd_p=2ae4ccb1-7034-4114-8654-5ba995870d70&pf_rd_r=J5K2ZGC6SD98PYBTD7M9&pd_rd_r=da95297f-8ba5-47e3-a9de-d0319ff1b94d&pd_rd_wg=hS7ZW&pd_rd_i=B006CSPZK4&psc=1,,
Fit & Fresh Cool Coolers Reusable Ice Packs Set of 4 Clear Package may vary,$12.68,4.6 out of 5 stars,18126 ratings,In Stock.,None,None,None,None,None,None,None,None,None," Make sure this fitsby entering your model number.SLIM ICE PACKS: Whether you’re headed back to work school or just want to escape the house for a picnic these Cool Coolers Slim Ice Packs are perfectly sized for all types of bags. Pack them in lunch bags coolers beach bags picnic baskets and more!COMPACT DESIGN: These ice packs are slim and compact yet powerful. They are perfect for tight spaces or stacking together for even greater cooling power. Each ice pack measures 4.75"" x 4.75"" x 0.25"" making them the perfect size for everyday use.LONG-LASTING: These reusable ice packs are designed to last long so you can head out knowing that what you pack will stay cool and fresh until you are ready to eat. For maximum cooling power freeze the ice packs the night before use.HEALTHY AND SAFE: Included in this set are 4 reusable non-toxic BPA-Free plastic ice packs. Prevent germs from the cafeteria shared office refrigerator or takeout containers by packing a lunch with these ice packs. Hand wash only do not microwave.WE ARE FIT & FRESH: Proudly designed by women for women we are dedicated to supporting your healthy lifestyle. We know that the key to living your best life is creating a colorful balance & we’re here with a line of accessories to help you do just that.",https://www.amazon.com/Fit-Fresh-Coolers-Jobsite-Camping/dp/B003FO2B5U/ref=pd_rhf_se_s_gcx-rhf_4/142-4042136-0822045?pd_rd_w=L0QYs&pf_rd_p=2ae4ccb1-7034-4114-8654-5ba995870d70&pf_rd_r=J5K2ZGC6SD98PYBTD7M9&pd_rd_r=da95297f-8ba5-47e3-a9de-d0319ff1b94d&pd_rd_wg=hS7ZW&pd_rd_i=B003FO2B5U&psc=1,,,
THERMOS FUNTAINER 12 Ounce Stainless Steel Vacuum Insulated Kids Straw Bottle Blue,$14.99,4.8 out of 5 stars,19304 ratings,In Stock.,None,None,None,None,None,None,None,None,None, Make sure this fitsby entering your model number.THERMOS vacuum insulation technology for maximum temperature retention not for use with hot liquidsDurable stainless steel interior and exteriorHygienic push button lid with pop-up straw and integrated carry handleKeeps cold 12 hours12 ounce capacity; hand washing recommendedIncluded Components: Thermos Funtainer 12 Ounce Bottle Blue,https://www.amazon.com/Thermos-Funtainer-Ounce-Bottle-Blue/dp/B00DAPQV0K/ref=pd_rhf_se_s_gcx-rhf_5/142-4042136-0822045?pd_rd_w=L0QYs&pf_rd_p=2ae4ccb1-7034-4114-8654-5ba995870d70&pf_rd_r=J5K2ZGC6SD98PYBTD7M9&pd_rd_r=da95297f-8ba5-47e3-a9de-d0319ff1b94d&pd_rd_wg=hS7ZW&pd_rd_i=B00DAPQV0K&psc=1,,,
"Oxford Filler Paper 8-1/2"" x 11"" College Rule 3-Hole Punched Loose-Leaf Paper for 3-Ring Binders 500 Sheets Per Pack (62349)White",None,4.8 out of 5 stars,9093 ratings,In Stock.,None,White,None,Oxford,None,None,None,None,None," Make sure this fitsby entering your model number.MORE PER PACK: this mega-pack of Oxford loose leaf filler paper has 500 college-ruled sheets for note taking list making and showing your work through all of your academic endeavorsFOR BINDERS & MORE: 8-1/2"" x 11"" sheets are letter sized and 3-hole punched to fit standard ring binders & pocket folders with fastenersCOLLEGE RULED FOR OLDER STUDENTS: pick the preferred ruling for those in middle and high school or for college and professional use; the 9⁄32"" spacing fits more writing per page than wide-ruled paperPAPER FOR EVERYDAY: Oxford provides quality binder paper perfect for normal everyday notetaking with your favorite ink or gel pens or pencil; this 3-hole punched filler paper is ready to fit your favorite notebookA STOCK-UP STAPLE: large packs of filler paper make it easy to shop ahead; show your forethought and shop for the entire school year or replenish your dwindling stock for second semester",https://www.amazon.com/Oxford-College-Punched-Loose-Leaf-62349/dp/B000J0B3VG/ref=pd_rhf_se_s_gcx-rhf_6/142-4042136-0822045?pd_rd_w=L0QYs&pf_rd_p=2ae4ccb1-7034-4114-8654-5ba995870d70&pf_rd_r=J5K2ZGC6SD98PYBTD7M9&pd_rd_r=da95297f-8ba5-47e3-a9de-d0319ff1b94d&pd_rd_wg=hS7ZW&pd_rd_i=B000J0B3VG&psc=1,,,
Crayola Colored Pencil Set School Supplies Assorted Colors 36 Count Long,$5.97,4.8 out of 5 stars,15937 ratings,In stock soon.,Wood,Multicolor,None,Crayola,None,None,None,None,None,COLORED PENCIL SET: Includes 36 Crayola Colored PencilsPRESHARPENED & DURABLE: Soft cores won't break easily and presharpened tips are ready for use right out of the boxCRAYOLA COLORS: Features 36 vibrant creamy pencil colorsSCHOOL SUPPLIES: Prepare the classroom for creative art projects and homework assignmentsSAFE AND NONTOXIC: Ideal for kids ages 5 and up,https://www.amazon.com/Crayola-Long-Lasting-Pre-Sharpened-Non-Toxic-Gradation/dp/B00006RVTS/ref=pd_rhf_se_s_gcx-rhf_7/142-4042136-0822045?pd_rd_w=L0QYs&pf_rd_p=2ae4ccb1-7034-4114-8654-5ba995870d70&pf_rd_r=J5K2ZGC6SD98PYBTD7M9&pd_rd_r=da95297f-8ba5-47e3-a9de-d0319ff1b94d&pd_rd_wg=hS7ZW&pd_rd_i=B00006RVTS&psc=1,,,
Sistema to Go Multi Split Meal & Food Dividers & Clips | 820ml | BPA-Free | 5 Storage Containers Food Prep,$22.30,4.8 out of 5 stars,194 ratings,In stock soon.,Plastic,None,None,Sistema,None,None,None,None,820 Milliliters,Food storage containers with dividers that are ideal for meal prep and portion control as well as storing different meal combos fruit pasta snacks and moreConvenient 5-pack is great for meal prepping for the week ahead as well as taking to school enjoying a packed lunch on days out storing leftovers and moreStackable design features ridged lids so they take up less space in the fridge freezer and pantryPhthalate and BPA-free plastic; top rack dishwasher-safe; fridge and freezer-safe; microwave-safe without lid; designed and made in New ZealandIncludes: 5 x Multi Split containers with lids (820ml),https://www.amazon.com/Sistema-Dividers-BPA-Free-Storage-Containers/dp/B08HB4GLKK/ref=pd_rhf_se_s_gcx-rhf_8/142-4042136-0822045?pd_rd_w=L0QYs&pf_rd_p=2ae4ccb1-7034-4114-8654-5ba995870d70&pf_rd_r=J5K2ZGC6SD98PYBTD7M9&pd_rd_r=da95297f-8ba5-47e3-a9de-d0319ff1b94d&pd_rd_wg=hS7ZW&pd_rd_i=B08HB4GLKK&psc=1,,,
Sharpie 27145 Pocket Highlighters Chisel Tip Assorted Colors 12-Count,$5.47,4.8 out of 5 stars,28079 ratings,In Stock.,None,None,None,SHARPIE,None,None,None,None,None, Make sure this fitsby entering your model number.Vivid high-contrast shades add colorful emphasis to highlighted textEasy-glide narrow chisel tip is great for highlighting underlining or writing notesResists smearing of many pen and marker inks (let ink dry before highlighting)User-friendly quick-drying and odorless AP certified formulaIncludes: 1 purple 2 blue 2 green 2 orange 2 pink and 3 yellow highlighters,https://www.amazon.com/Sharpie-27145-Highlighters-Assorted-12-Count/dp/B002BA5WMI/ref=pd_rhf_se_s_gcx-rhf_9/142-4042136-0822045?pd_rd_w=L0QYs&pf_rd_p=2ae4ccb1-7034-4114-8654-5ba995870d70&pf_rd_r=J5K2ZGC6SD98PYBTD7M9&pd_rd_r=da95297f-8ba5-47e3-a9de-d0319ff1b94d&pd_rd_wg=hS7ZW&pd_rd_i=B002BA5WMI&psc=1,,,
Five Star 4 Pocket Folders 2 Pocket Folders Plus 2 Additional Pockets Assorted Colors 6 Pack (38058),$11.00,4.7 out of 5 stars,5881 ratings,In Stock.,Poly,Primary,None,Five Star,None,None,None,None,None," Make sure this fitsby entering your model number.LASTS ALL YEAR. GUARANTEED.2 horizontal pockets and 2 vertical pockets provide ultimate support to keep papers in placeLaminated surface is water-resistant and protects documents from accidental spills3-hole punched to store in your favorite Five Star binder. Useful information is printed inside folder including the periodic table rulers and conversion charts for quick referenceHolds 8-1/2"" x 11"" papers. Primary 6 pack is available in assorted colors including: Black Red Electric Green Cobalt White and Royal Purple",https://www.amazon.com/Five-4-Pocket-Paper-Folder-Primary/dp/B01E0E8FCQ/ref=pd_rhf_se_s_gcx-rhf_10/142-4042136-0822045?pd_rd_w=L0QYs&pf_rd_p=2ae4ccb1-7034-4114-8654-5ba995870d70&pf_rd_r=J5K2ZGC6SD98PYBTD7M9&pd_rd_r=da95297f-8ba5-47e3-a9de-d0319ff1b94d&pd_rd_wg=hS7ZW&pd_rd_i=B01E0E8FCQ&psc=1,,,
Paper Mate Pink Pearl Erasers Large 12 Count,$5.47,4.8 out of 5 stars,13093 ratings,In Stock.,Rubber,Pink,None,Paper Mate,None,None,None,None,None, Make sure this fitsby entering your model number.100% latex-free and smudge-resistant eraser to keep your pages freshClean finish is perfect for Exams essays and everyday writing trusted choice for standardized testsSharp corners and flat face help you erase both details and large areasClassic design is ideal for everyone from students to serious artistsIncludes: 12 Pink erasers,https://www.amazon.com/Paper-Mate-Pearl-Erasers-Large/dp/B00094H4LU/ref=pd_rhf_se_s_gcx-rhf_11/142-4042136-0822045?pd_rd_w=L0QYs&pf_rd_p=2ae4ccb1-7034-4114-8654-5ba995870d70&pf_rd_r=J5K2ZGC6SD98PYBTD7M9&pd_rd_r=da95297f-8ba5-47e3-a9de-d0319ff1b94d&pd_rd_wg=hS7ZW&pd_rd_i=B00094H4LU&psc=1,,,
Rubbermaid LunchBlox Sandwich Kit Green 1806231Green Blue,$10.00,4.6 out of 5 stars,7051 ratings,In Stock.,Plastic,Green, Blue,Sandwich Kit,Rubbermaid,None,⭐️ Exclusive,None,None,5 Cups, Make sure this fitsby entering your model number.Modular containers snap together to save space and stay organized and can be stacked to fit various lunch bag shapes and sizesBlue Ice freezer packs snap directly to food containers keeping lunch chilled when you're on the goDurable lunch box containers have a secure lid seal to prevent leakingKit Includes: 2 Snack Containers (.5 cup capacity) 1 Side Container (1.2 cup capacity) 1 Sandwich Container (2.6 cup capacity) and 1 Medium Blue Ice (Size: 4.81 inches L x 5.625 inches W x 5.25 inches H when stacked)Microwave dishwasher and freezer safe BPA free,https://www.amazon.com/Rubbermaid-LunchBlox-Sandwich-Green-1806231/dp/B0078K416Y/ref=pd_rhf_se_s_gcx-rhf_12/142-4042136-0822045?pd_rd_w=L0QYs&pf_rd_p=2ae4ccb1-7034-4114-8654-5ba995870d70&pf_rd_r=J5K2ZGC6SD98PYBTD7M9&pd_rd_r=da95297f-8ba5-47e3-a9de-d0319ff1b94d&pd_rd_wg=hS7ZW&pd_rd_i=B0078K416Y&psc=1,,
Elmer's Disappearing Purple School Glue Washable 30 Pack 0.24-ounce sticks,$6.97,4.8 out of 5 stars,36628 ratings,In Stock.,None,Standard Stick,None,Elmer's,None,None,None,None,None, Make sure this fitsby entering your model number.Disappearing purple formula helps kids see where the glue isDries clear and applies smoothly for a mess free appearanceThe number one teacher brand it’s ideal for younger learners making poster presentations crafting and moreWashable nontoxic acid free formula is ideal for classrooms and homesIncludes: 30 0.24 ounce (7 gram) Elmer’s craft glue sticks,https://www.amazon.com/Elmers-Disappearing-Purple-Washable-0-24-ounce/dp/B000VXO4L2/ref=pd_rhf_se_s_gcx-rhf_13/142-4042136-0822045?pd_rd_w=L0QYs&pf_rd_p=2ae4ccb1-7034-4114-8654-5ba995870d70&pf_rd_r=J5K2ZGC6SD98PYBTD7M9&pd_rd_r=da95297f-8ba5-47e3-a9de-d0319ff1b94d&pd_rd_wg=hS7ZW&pd_rd_i=B000VXO4L2&psc=1,,,
Elmer's Disappearing Purple School Glue Sticks 0.77 oz Each 3 Sticks per Pack (E562),$2.44,4.8 out of 5 stars,36628 ratings,In Stock.,None,Large Stick,None,Elmer's,None,None,None,None,None, Make sure this fitsby entering your model number.Everyone's favorite for easy no mess bondingGoes on purple and dries clear so you can see where you are gluingSmooth for easy applicationAcid free photo safe non toxic and washablePack of 3 jumbo glue sticks,https://www.amazon.com/Elmers-Disappearing-Purple-School-E562/dp/B00143SNPG/ref=pd_rhf_se_s_gcx-rhf_14/142-4042136-0822045?pd_rd_w=L0QYs&pf_rd_p=2ae4ccb1-7034-4114-8654-5ba995870d70&pf_rd_r=J5K2ZGC6SD98PYBTD7M9&pd_rd_r=da95297f-8ba5-47e3-a9de-d0319ff1b94d&pd_rd_wg=hS7ZW&pd_rd_i=B00143SNPG&psc=1,,,
Legend of Zelda Breath of the Wild Link Deluxe Boys Costume (7/8),$32.10,4.5 out of 5 stars,1305 ratings,In Stock.,None,None,None,None,None,None,None,None,None, Make sure this fitsby entering your model number.100% PolyesterImportedProduct includes: tunic top with attached pants chest belt belt with attached pouches pair of character ears and pair of boot coversNintendo - legend of ZeldaOfficially licensed product,https://www.amazon.com/Link-Breath-Deluxe-Costume-Medium/dp/B01N9XB1KM/ref=pd_rhf_se_s_gcx-rhf_15/142-4042136-0822045?pd_rd_w=L0QYs&pf_rd_p=2ae4ccb1-7034-4114-8654-5ba995870d70&pf_rd_r=J5K2ZGC6SD98PYBTD7M9&pd_rd_r=da95297f-8ba5-47e3-a9de-d0319ff1b94d&pd_rd_wg=hS7ZW&pd_rd_i=B01N9XB1KM&psc=1,,,
BUILT Gourmet Getaway Soft Neoprene Lunch Tote Bag - Lightweight Insulated and Reusable Black LB31-BLK,None,4.8 out of 5 stars,3592 ratings,Available to ship in 1-2 days.,Neoprene,Black,Gourmet Getaway,BUILT,None,Solid,None,None,None, Make sure this fitsby entering your model number.MACHINE WASHABLE: This mid sized stretchy neoprene lunch tote is made from machine washable neoprene; No need to worry about accidents and spills inside or outside your tote because you can easily machine wash it on cold and let it air dryNEOPRENE INSULATING MATERIAL: Keeps food cold (or warm) for up to 4 hours depending on the content and outside temperature; The cooler the contents the longer they will stay coldDURABLE & REUSABLE: This lunch bag is reusable and extremely durable stain tear and water resistant while being lightweight so it doesn’t add to your loadEXPANDABLE & STORES FLAT: The neoprene material allows the lunch tote to expand to fit a variety of food and drink containers with a flat bottom to sit upright. This tote packs more than you would think but is still able to fold flat to take up less spaceSECURE ZIPPER CLOSURE & EASY TO CARRY: This lunch tote has a smooth secure zipper closure to keep your lunch inside when you are on the go; The soft grip neoprene handles make it easy to carry; Neoprene stretches for maximum comfort on your fingers,https://www.amazon.com/LB31-BLK-Neoprene-Bag-Lightweight-Insulated-Reusable/dp/B000ECE5WS/ref=pd_rhf_se_s_gcx-rhf_16/142-4042136-0822045?pd_rd_w=L0QYs&pf_rd_p=2ae4ccb1-7034-4114-8654-5ba995870d70&pf_rd_r=J5K2ZGC6SD98PYBTD7M9&pd_rd_r=da95297f-8ba5-47e3-a9de-d0319ff1b94d&pd_rd_wg=hS7ZW&pd_rd_i=B000ECE5WS&psc=1,,,
Elmer's Disappearing Purple School Glue Sticks Washable 0.21 Ounce Glue Sticks for Kids | School Supplies | Scrapbooking Supplies | Vision Board Supplies 12 Count,$3.92,4.8 out of 5 stars,36628 ratings,In Stock.,None,Standard Stick,None,Elmer's,None,None,None,None,None, Make sure this fitsby entering your model number.Bonds to paper cardboard foam board display board and moreGoes on purple and dries clearWashes easily off hands and out of clothesNon toxic and acid freePerfect for arts crafts and school projects,https://www.amazon.com/Elmers-Disappearing-Purple-School-Washable/dp/B003ULCZ7M/ref=pd_rhf_se_s_gcx-rhf_17/142-4042136-0822045?pd_rd_w=L0QYs&pf_rd_p=2ae4ccb1-7034-4114-8654-5ba995870d70&pf_rd_r=J5K2ZGC6SD98PYBTD7M9&pd_rd_r=da95297f-8ba5-47e3-a9de-d0319ff1b94d&pd_rd_wg=hS7ZW&pd_rd_i=B003ULCZ7M&psc=1,,,
Mead Composition Notebooks Comp Books Wide Ruled Paper 100 Sheets 9-3/4 x 7-1/2 inches Classic Black Marble 3 Pack (38301),$6.00,4.8 out of 5 stars,7435 ratings,In stock soon.,None,Black,None,Mead,None,None,None,None,None, Make sure this fitsby entering your model number.Composition book contains 100 double sided sheetsWide ruling gives you plenty of space for notetakingSewn binding is smooth and keeps pages securely in placeInside covers feature a class schedule multiplication tables conversion tables and grammar rulesPages measure 9 3/4 Inches x 7 1/2 Inches. Black marble cover. 3 Pack,https://www.amazon.com/Mead-Composition-Notebooks-Sheets-38301/dp/B071NRXVBP/ref=pd_rhf_se_s_gcx-rhf_18/142-4042136-0822045?pd_rd_w=L0QYs&pf_rd_p=2ae4ccb1-7034-4114-8654-5ba995870d70&pf_rd_r=J5K2ZGC6SD98PYBTD7M9&pd_rd_r=da95297f-8ba5-47e3-a9de-d0319ff1b94d&pd_rd_wg=hS7ZW&pd_rd_i=B071NRXVBP&psc=1,,,
THERMOS FUNTAINER 10 Ounce Stainless Steel Vacuum Insulated Kids Food Jar Blue,$15.99,4.7 out of 5 stars,23986 ratings,In Stock.,None,None,None,None,None,None,None,None,None, Make sure this fitsby entering your model number.THERMOS vacuum insulation technology for maximum temperature retention hot or coldDurable stainless steel interior and exteriorWide mouth is easy to fill serve from and cleanKeeps cold for 7 hours and hot for 5 hours; stay cool exterior10 ounce capacity; hand washing is recommendedIncluded Components: Thermos Funtainer Food Jar - Blue,https://www.amazon.com/Thermos-Funtainer-Ounce-Food-Blue/dp/B00CBFAE6W/ref=pd_rhf_se_s_gcx-rhf_19/142-4042136-0822045?pd_rd_w=L0QYs&pf_rd_p=2ae4ccb1-7034-4114-8654-5ba995870d70&pf_rd_r=J5K2ZGC6SD98PYBTD7M9&pd_rd_r=da95297f-8ba5-47e3-a9de-d0319ff1b94d&pd_rd_wg=hS7ZW&pd_rd_i=B00CBFAE6W&psc=1,,,
CleverMade Collapsible Cooler Bag: Insulated Leakproof 50 Can Soft Sided Portable Cooler Bag for Lunch Grocery Shopping Camping and Road Trips Heather Grey/Black,$36.32,4.6 out of 5 stars,6066 ratings,In Stock.,Polyester,Heathered Charcoal / Black,None,CleverMade,None,None,None,None,8 Gallons," Make sure this fitsby entering your model number.Large capacity SnapBasket Tahoe Coolers can hold up to 50 cans of your favorite drinks plus ice; perfect for use at the beach while camping or to load up full of snacks for youth sports games outdoorsPatented SnapHinges on both sides of the cooler bag offer structured support when the tote is open; to close the cooler simply push the side hinges in folding the compact bag down flatVersatile totes can be packed up for a daytime picnic and are small enough to place in the trunk of your SUV as an ice chest on road trips; collapesed down the cooler can fit in your suitcase for vacation. Recommended to use with Clever IceThe perfect size for food delivery services and a great solution to haul groceries from the store or farmer's market to your kitchen at home; comfortable handle and duffel bag handles make toting heavy loads easyMeasures 18.25""L x 12.25""W x 11.5""H when open and collapses flat to 3""; weighs 2 pounds when empty; lightweight bag holds 30 liters (8 gallons) by volume with a load capacity of 50 pounds",https://www.amazon.com/CleverMade-SnapBasket-Soft-Sided-Collapsible-Cooler/dp/B01KPW8ZEK/ref=pd_rhf_se_s_gcx-rhf_20/142-4042136-0822045?pd_rd_w=L0QYs&pf_rd_p=2ae4ccb1-7034-4114-8654-5ba995870d70&pf_rd_r=J5K2ZGC6SD98PYBTD7M9&pd_rd_r=da95297f-8ba5-47e3-a9de-d0319ff1b94d&pd_rd_wg=hS7ZW&pd_rd_i=B01KPW8ZEK&psc=1,,,
Amazon Basics Heavy Duty Plastic Folders with 2 Pockets for Letter Size Paper Pack of 6,$11.11,4.8 out of 5 stars,5677 ratings,In stock soon.,Paper,Assorted Color,2 Pockets,Amazon Basics,None,None,None,None,None, Make sure this fitsby entering your model number.6-pack of folders for storing and transporting letter-size documentsMade of heavy-duty PP plastic in an assortment of vibrant colors (red orange yellow green blue and purple)Metal prongs allow for securely fastening pages into place2 pockets front and back provide extra storage space for loose papersMeasures 9.4 by 0.2 by 11.4 inches; backed by an Amazon Basics 1-year limited warranty,https://www.amazon.com/AmazonBasics-Plastic-Pocket-Folder-Letter/dp/B07K8XVD11/ref=pd_rhf_se_s_gcx-rhf_21/142-4042136-0822045?pd_rd_w=L0QYs&pf_rd_p=2ae4ccb1-7034-4114-8654-5ba995870d70&pf_rd_r=J5K2ZGC6SD98PYBTD7M9&pd_rd_r=da95297f-8ba5-47e3-a9de-d0319ff1b94d&pd_rd_wg=hS7ZW&pd_rd_i=B07K8XVD11&psc=1,,,
Crayola 68-4012 Colored Pencils 12-Count Pack of 2 Assorted Colors,$6.99,4.8 out of 5 stars,3097 ratings,In stock soon.,Wood,Assorted,None,Crayola,None,None,None,None,None, Make sure this fitsby entering your model number.Presharpened points12 bright colorsArt tools Made from reforested woodManufacturer: Crayola,https://www.amazon.com/Crayola-68-4012-Colored-12-Count-Assorted/dp/B00FX9DFAU/ref=pd_rhf_se_s_gcx-rhf_22/142-4042136-0822045?pd_rd_w=L0QYs&pf_rd_p=2ae4ccb1-7034-4114-8654-5ba995870d70&pf_rd_r=J5K2ZGC6SD98PYBTD7M9&pd_rd_r=da95297f-8ba5-47e3-a9de-d0319ff1b94d&pd_rd_wg=hS7ZW&pd_rd_i=B00FX9DFAU&psc=1,,,
