Title,Price,Rating,Review,Availability,Material,Color,Style,Brand,Item Dimension L*W*H,Pattern,Item Weight,Age Range,Capacity,Discription,URL,,,
Lunch Bag for Women & Men Large Insulated Lunch Box Cooler Tote Bags Adult Reusable Lunch Boxes with Water Resistant for Work School Travel and Picnic (Grey),None,4.8 out of 5 stars,610 ratings,None,Oxford fabric,Gray,Modern,EASYFUN,None,None,None,Adult,None, Make sure this fitsby entering your model number.👜HUMANIZED STRUCTURE: Insulated lunch bag adopts opening design and dual zipper there are metal wires on both sides of the opening to fix the opening allowing you to easily put in/take out the lunch box drink and food. The fashionable style design makes the lunch bag is ideal to be used for men and women.👜LARGE CAPACITY: Size: 10.5LX6.5WX10H. This lunch box has a large internal capacity which can hold up to 12 Cans. The front pocket can be put into tableware snack wallets or mobile phones and daily supplies. The mesh pockets on both sides can be put into water bottles and umbrellas.💧GREAT MATERIAL: The lunch bag has been upgraded thick aluminium foil lining is seamless to enhance leakage prevention，easy to clean inside compartment; The thick insulating foam in the middle layer of the cooler bag can keep food cool warm and fresh for a long time; The exterior uses Oxford cloth material which is waterproof and wear-resistant.👤MULTIFUNCTIONAL USE: Heavy duty lunch box of the handle is made of linen material and combined with high-tech sewing technology so that lunch tote strong and durable which can hold lunch boxes fruits and drinks at the same time allowing you to taste warm food and cold drinks in office areas schools picnics travel and camping.🔔WARRANTY SERVICE: We provide you with three-month warranty service. In the process of using the lunch bag please feel free to contact us if you have any questions we will do our best to solve it for you.,https://www.amazon.com/Insulated-Cooler-Reusable-Resistant-School/dp/B08SBSL1LG/ref=sr_1_31?dchild=1&keywords=Lunch+Bag&qid=1628206630&refinements=p_85%3A2470955011&rnid=2470954011&rps=1&s=home-garden&sr=1-31,,,
Yodo Kids Insulated Lunch Tote Bag with Name Tag for Girls Butterfly,None,4.8 out of 5 stars,589 ratings,None,Polyester,Butterfly,Casual,Yodo,None,Cartoon,None,Adult,None,HOLD EVERYTHING YOU WANT -- Large Compartment enough for holding everything you want to pack for your kiddos. You can pack Lunch Box Cookies Fruits Juices or Snacks. Extra Mesh Pocket inside and Open Pouch at back for Ice Pack Napkins or UtensilsEXCELLENT INSULATION PERFORMANCE -- BPA free Lining keeps lunch fruits snacks or drinks cold or warm up to 3 hours. SUPER EASY CLEAN - Made of Patented PEVA Lining (BPA free and FDA compliant). Stains marks or food residues can be wiped clean easily and dry fastCUSTOM KIDS UNIQUE BAG -- with NAME TAG at back your little one can write the name or drawing on the tag. Design a friend belongs to him/her onlyEASY TAKE & PACK -- Extra Padded Handle protect children’s hands and offer all day comfort. Soft Body could be flatten and pack into larger size bag or storage box. HIGH QUALITY ACCESSORIES – Durable Yodo Zippers makes this bag last long timeSIZE-- L8.9 x W3.7 x H10 inch just right for Kids Age 3-15 years.If you have any quality issue or you are not completely satisfied with this lunch tote please feel free to contact us. We are always available to help,https://www.amazon.com/Yodo-Insulated-Lunch-Girls-Butterfly/dp/B0747KJF58/ref=sr_1_32?dchild=1&keywords=Lunch+Bag&qid=1628206630&refinements=p_85%3A2470955011&rnid=2470954011&rps=1&s=home-garden&sr=1-32,,,
NIUTA Insulated Lunch Bag for Men/Womens Lunch Box Upgraded version Double Deck Reusable Lunch Pail (Black),None,4.8 out of 5 stars,534 ratings,None,None,Black,None,NIUTA,10 x 6.7 x 8 inches,None, 13.44 Ounces,None,None," Make sure this fitsby entering your model number.★ Premium Lining & Zipper: The lining of lunch bag is made of PEVA foil that won't melt easily when the bag hold something hot at the same time which can keep foods and drinks cool or warm for more than 6 hours. we use a high quality zipper which will minimize the possibility of broken zipper.★ Convenient and Portable - The lunch bag comes with a detachable and adjustable shoulder strap which can be adjusted from 15"" to 27"" when carrying offer you more carrying options. which makes it easy to carry by hand or greatly tied to your backpack or along side a briefcase. It is convenient to be used as your lunch bag cooler bag picnic bag sundry bag or shopping bag.★ Insulated Lunch Tote Bag -- The lunch tote bag is built with insulated material. And the lunch tote bag interior padded with thick insulation for keeping food stay cold/warm/fresh for hours Easy to clean the inside compartmentNote that the lunch bag is only slightly waterproof★SPACIOUS & MULTI COMPARTMENTS: NIUTA lunch bag (10 x 7 x 8 inch) is designed for maximum storage efficiency 1 main zipped compartment 1 front zippered pocket 1 back pocket 2 mesh pockets and 1 internal mesh pocket not only provides you with plenty of space to pack all of your food and snacks you need whole day as well as pack your keys cards phone chargers napkins water bottles gum or other small stuffs you daily needs.★ MULTI-USE & CONVENIENT: Great for men and women to pack food and drinks for work school picnics beach road trips camping traveling or any outdoor activities. Our reusable lunch pail is perfect to preserve freshness for those on the go. Our factories follow a strict set of specifications and quality standards however if a problem develops we will provide you with the best solution!",https://www.amazon.com/NIUTA-Insulated-Upgraded-version-Reusable/dp/B08PDLYGGP/ref=sr_1_34?dchild=1&keywords=Lunch+Bag&qid=1628206630&refinements=p_85%3A2470955011&rnid=2470954011&rps=1&s=home-garden&sr=1-34,,,
Simple Modern Kids Lunch Box-Insulated Reusable Meal Container Bag for Girls Boys Women Men Small Hadley Unicorn Fields,$15.99,4.8 out of 5 stars,515 ratings,Only 2 left in stock - order soon.,Polyester,#NAME?,Modern,Simple Modern,None,None,None,Kid,4 Liters, Make sure this fitsby entering your model number.This 4 liter lunch box is a triple insulated single compartment rectangular bag ideal for kids school picnics road trips lunch at the office the beach and more!Hand made with high-quality polyester strong zippers and durable reinforced stitching that maintains the bag's shapeFeatures one reinforced handle on top with a snap buckle to carry by hand and clip to a backpack; an exterior zipper-closure pocket; an interior zipper-closure pocket; and an interior elastic tie that’ll safely secure a drink4L Lunch Bag: The outside of the bag measures 10.2 inches wide (26 cm) 8.2 inches tall (21 cm) and 3.7 inches deep (9.5 cm).We Exist to Give Generously: Simple Modern is built on serving you offering remarkable value and giving more than 10% of profit. All products are covered by a limited lifetime warranty.,https://www.amazon.com/Simple-Modern-Hadley-Incoming-Unicorn/dp/B08FFMXZ5C/ref=sr_1_35?dchild=1&keywords=Lunch+Bag&qid=1628206630&refinements=p_85%3A2470955011&rnid=2470954011&rps=1&s=home-garden&sr=1-35,,,
Pineapple Lunch Bag Cute Kids Reusable Cooler Lunch Tote Bag Insulated Leakproof Lunch Box Container with Front Pocket for Girls Boys School Work Picnic (White),None,4.8 out of 5 stars,516 ratings,None,Polyester,Whte Pineapple,None,YCGRE,None,None,None,Adult,None, Make sure this fitsby entering your model number.✅Stylish & Durable Lunch Bag: This lunch bag can be used as lunch bag picnic bag sundry bag suitable for all age groups. Made of the highly 600D polyester waterproof lining and sturdy zippers. Great insulation and frozen with ice pack will taste better and fresh longer. 2 short handles allow you to quickly pick up and go✅Larger Capacity & Exterior Pocket: L:10 x W:6.3 x H:8.2 inches.This lunch bag looks small but with large capacity it could perfectly fit your lunch box snacks fruitsand even protein shake bottle. The front pocket on outside super handy for small items organizing like phones keys cards small napkins. Very convenient if you in a rush and just have to skip something in real quick✅Eco-friendly Insulation Material: Premium fabric makes this lunch box durable sturdy and easy to clean. Added with 5 mm heavy foam between top fabric and inner layer would always keep food and drinks warm or fresh. It's non-toxic and safe for your food✅Perfect On The Go: This lunch tote is light-weight and foldable easy to carry. Is very easy to take anywhere like picnic day trips beach and sports. It is also a great gift for your friends or family members✅Buy with Confidence: Our company responsible for any unsatisfied order sold by YCGRE store. If you are not satisfied with our lunch bag we offer 3 month return or send a new replacement. we are always doing best to insure every customer get a great lunch bag. For any question please feel free to contact us,https://www.amazon.com/Pineapple-Reusable-Multi-functional-Insulated-Outdoor/dp/B085S7RZ7S/ref=sr_1_36?dchild=1&keywords=Lunch+Bag&qid=1628206630&refinements=p_85%3A2470955011&rnid=2470954011&rps=1&s=home-garden&sr=1-36,,,
Dinosaur Lunch Bag Reusable Cute Lunch Box Insulated Kids Cooler Tote Bag Multi-functional School Lunch Container for Teen Boys Girls (Dark Cyan),None,4.8 out of 5 stars,493 ratings,None,Polyester,Dark Cyan,None,YCGRE,None,None,None,Teen,None, Make sure this fitsby entering your model number.✅Stylish & Durable Lunch Bag: This lunch bag can be used as lunch bag picnic bag sundry bag suitable for all age groups. Made of the highly 600D polyester waterproof lining and sturdy zippers. Great insulation and frozen with ice pack will taste better and fresh longer. 2 short handles allow you to quickly pick up and go✅Larger Capacity & Exterior Pocket: L:10 x W:6.3 x H:8.2 inches.This lunch bag looks small but with large capacity it could perfectly fit your lunch box snacks fruitsand even protein shake bottle. The front pocket on outside super handy for small items organizing like phones keys cards small napkins. Very convenient if you in a rush and just have to skip something in real quick✅Eco-friendly Insulation Material: Premium fabric makes this lunch box durable sturdy and easy to clean. Added with 5 mm heavy foam between top fabric and inner layer would always keep food and drinks warm or fresh. It's non-toxic and safe for your food✅Perfect On The Go: This lunch tote is light-weight and foldable easy to carry. Is very easy to take anywhere like picnic day trips beach and sports. It is also a great gift for your friends or family members✅Buy with Confidence: Our company responsible for any unsatisfied order sold by YCGRE store. If you are not satisfied with our lunch bag we offer 3 month return or send a new replacement. we are always doing best to insure every customer get a great lunch bag. For any question please feel free to contact us,https://www.amazon.com/Dinosaur-Reusable-Insulated-Multi-functional-Container/dp/B085RZYTKD/ref=sr_1_37?dchild=1&keywords=Lunch+Bag&qid=1628206630&refinements=p_85%3A2470955011&rnid=2470954011&rps=1&s=home-garden&sr=1-37,,,
"Octonauts Insulated Lunch Sleeve - Reusable School Lunch Box for Kids - Heavy Duty Tote Bag w Mesh Pocket - ""Rescue Mission""",None,4.8 out of 5 stars,462 ratings,None,Other,Rescue Mission,None,Octonauts,None,None,None,Adult,None," Make sure this fitsby entering your model number.Octonauts - Rescue Mission - Dims 8.5""x11""x3""Insulated Lunch Box Sleeve - reusable and durableKeep food warm or cold on the go. Mesh pocket on the back for additional storageSlim design allows for easy storage without the bulkFood Safe - No lead BPA phthalates. (Containers Not Included)",https://www.amazon.com/Octonauts-Insulated-Lunch-Sleeve-Reusable/dp/B078XHYS5H/ref=sr_1_38?dchild=1&keywords=Lunch+Bag&qid=1628206630&refinements=p_85%3A2470955011&rnid=2470954011&rps=1&s=home-garden&sr=1-38,,,
Lilly Pulitzer Thermal Insulated Lunch Box for Women Cooler Bag with Adjustable/Removable Shoulder Strap It Was All A Dream,$29.95,4.8 out of 5 stars,447 ratings,None,Polyester, EVA lining, metal hardware,It Was All A Dream,Lunch Bag,Lilly Pulitzer,None,None,None,Adult,None, Make sure this fitsby entering your model number.Insulated interior: Lunch box features a solid white insulated interior lining that keeps foods at the right temp inside. The thermal interior is easy to wipe clean with a damp cloth in case things get messy while on-the-go.Easy to carry: Lunch tote features a 21 inch strap (53.3 cm) that is both adjustable and removable to help you find your best fit (making it perfect for both children and adults!). Includes a sturdy top handle to allow the insulated bag to be carry by hand if needed.Convenient zip closure: Small lunch bag features a double zipper close that keeps contents secure while traveling. Cooler bag can be placed on its back and unzipped to lie completely open for easy packing/unpacking.Sufficient storage: Lunch cooler measures 9 inches (22.8 cm) long x 3.75 inches (9.5 cm) wide x 7 inches (17.8 cm) tall and features a main compartment that is large enough to store a days worth of food (including a full size water bottle). Also includes an open exterior pocket to keep easily accessible items like utensils or napkins.Premium design: Adult/kids lunch box is made of a high quality material that is featured in the Lilly Pulitzer print It Was All A Dream along with a metallic gold logo plaque. Features metal hardware and thick cotton straps for added durability. This cute lunch bag has a flat base to help it stay upright in refrigerators and on tables so you don't have to worry about making a mess.,https://www.amazon.com/Lilly-Pulitzer-Insulated-Adjustable-Removable/dp/B08BPHSWB1/ref=sr_1_39?dchild=1&keywords=Lunch+Bag&qid=1628206630&refinements=p_85%3A2470955011&rnid=2470954011&rps=1&s=home-garden&sr=1-39,
RecooTic Kids Spiderman Lunch Bag Waterproof Insulated lunchbox Lunch Tote Bag for School Work Office,None,4.8 out of 5 stars,444 ratings,None,Neoprene,Red,None,RecooTic,None,Cartoon,None,Adult,None, Make sure this fitsby entering your model number.Manufacturer_minimum_age is 36 months.EASY TO CLEAN: Can be repeated cleaning easy to dry it's ready to go each and every day. Waterproof breathable and soft.GREAT FOR KIDS & ADULTS: Both children going to school and adults going to work can find great use in this versatile lunchbox. Use it for food holding a bento box snacks.IDEAL FOOD TEMPERATURES: Our Lunch Bags Made of Fine MaterialVinyl-free PVC-free lunch bag keeps your food cold or hot depending on your needs.SECURE ZIPPER CLOSURE: They not only offer an easy-to-use zip enclosure at the top Zip closureart image on both sidesFolds flat for storagebut Expands to fit a Variety of Containers and they can fold flat or roll up when not in use.,https://www.amazon.com/RecooTic-Spiderman-Waterproof-Insulated-Neoprene/dp/B07X7WRG12/ref=sr_1_40?dchild=1&keywords=Lunch+Bag&qid=1628206630&refinements=p_85%3A2470955011&rnid=2470954011&rps=1&s=home-garden&sr=1-40,,,
Lunch Bag Bagseri Insulated Lunch Bags for Women and Men with Transparent Phone Holder Pocket Reusable Lunch Cooler Box Thermal Organizer Water-resistant Lining (Blue),None,4.8 out of 5 stars,441 ratings,None,Polyester, Ethylene Vinyl Acetate,Blue,None,Bagseri,15.35 x 1.18 x 9.06 inches,None, 8.32 Ounces,Adult,None," Make sure this fitsby entering your model number.【Unique Mobile Phone Holder】Convenient to hold your mobile phone with the transparent pocket on the reusable lunch box for women. You can also use the screen touch function easily when watch videos and movies at lunch time. Just enjoy your lunchtime now!【Keep Food Healthy & Fresh】Made of food grade safety material and BPA Free PEVA liner with thick thermal insulation so your food can remain cool or hot for 7~8 hours with this lunchbox. You can certainly enjoy a healthy fresh and tasty homemade lunch. Never worry about harmful chemicals!【Larger Capacity & Lightweight】Spacious compartment provides enough space to store all your sandwiches snacks fruits vegetables or drinks. Perfect sizes of 10.63"" x 6.3"" x 8.66""(L*W*H) you don't have to carry around a bulky cooler or squeeze an inconvenient container into the office fridge.【Portable Stylish Lunch Bags】Stylish design makes it can be used in many occasion as you prefer like work school picnic or any outdoor activities. Durable and comfortable handles on the lunch tote make it carry at ease so you can enjoy the fresh meals every day!【Perfect Gifts For Friend & Family】The insulated lunch box is a perfect gift for Christmas White Elephant Gift Exchange New Year fitting for women men kids boys girls.",https://www.amazon.com/Bagseri-Insulated-Transparent-Organizer-Water-resistant/dp/B08MF7NQNC/ref=sr_1_41?dchild=1&keywords=Lunch+Bag&qid=1628206630&refinements=p_85%3A2470955011&rnid=2470954011&rps=1&s=home-garden&sr=1-41,,
ZZKKO Cactus Succulent Floral Lunch Bag Box Tote Organizer Lunch Container Insulated Zipper Meal Prep Cooler Handbag For Women Men Home School Office Outdoor Use,None,4.8 out of 5 stars,422 ratings,None,None,Cactus,None,ZZKKO,None,Floral,None,Adult,5 Liters," Make sure this fitsby entering your model number.Size: 9.8""(L)x6.7""(W)x8.7""(H)/25(L)cmx17(W)cmx8.7(H)cmMaterial: made with waterproof 300D oxford material and easy to clean food-grade aluminum foil light weight upgraded duarable smooth zipper Two short handles allow you to quickly pick up and go.Functions: this unique lunch bag offers a 5L storage space can be used as lunch bag picnic bag sundry bag food & sandwich bags grocery shopping bags ect suitable for all age groups.Occassion: very perfect to pack food and storage containers when you're in work office school hospital beach travel weekend picnic camping hiking fishing cycling etc. It will keep your food cold / warm/fresh for about 6 hours.One front pocket design could organize your napkin and personal stuff such as your phonebus cardect.Design: single-sided printing personalized customization makes you unique. Also a good ideal gift choice for friends family members lover or colleagues.",https://www.amazon.com/ZZKKO-Succulent-Organizer-Container-Insulated/dp/B083XBQGTT/ref=sr_1_42?dchild=1&keywords=Lunch+Bag&qid=1628206630&refinements=p_85%3A2470955011&rnid=2470954011&rps=1&s=home-garden&sr=1-42,,,
Lunch Bag for Women Men Insulated Durable Reusable lunch Box with Adjustable Shoulder Strap Wide-Open Thermal Cooler tote Bag Water Resistant,None,4.8 out of 5 stars,410 ratings,None,Oxford cloth,A-Gray flower,None,GITIBAB,None,None,None,Adult,None," Make sure this fitsby entering your model number.✅【UPGRADE LARGER SIZE】-Lunch box designs a larger main food compartment (10.5 x 7.5 x 9 inch) Roomy space can store all your need for the entire day.2 side pockets design perfect to organize your napkin and personal stuff such as your phone bus card tissue etc.✅【Keep Your Food Fresh】- This insulated lunch bag made of waterproof 600D durable oxford cloth Easy clean lining to protect against bacterial odors and stains Padded With 5mm EPE foam will keep your food cold or warm (4-6 hours) when you're taking on the daily grind. BPA free materials ensure your health.✅【Wide Open Design Convenient】-Convenient-Top of the bag can be opened up to 13""L x 9.1""W by zipper closure easily and quickly put in and take out lunch box or other foods you want from up deck see inside with 100% view never worry about to waste your time to find any small items! Improve daily user experience.✅【Hands-free】- The fashionable reusable lunch box comes with a detachable shoulder strap. Which makes it easy to carry by hand or greatly tied to your backpack or alongside a briefcase. The soft cotton handle is comfortable for your hands.✅【Buy with Confidence】- If there is any problem we have a 1-YEAR WARRANTY and we provide professional customer service. we offer you a 30 days refund or replacement. So Buy it without any hesitation!",https://www.amazon.com/Insulated-Reusable-Adjustable-Wide-Open-Resistant/dp/B08MQLB4V2/ref=sr_1_43?dchild=1&keywords=Lunch+Bag&qid=1628206630&refinements=p_85%3A2470955011&rnid=2470954011&rps=1&s=home-garden&sr=1-43,,,
DTBG Lunch Bags for Women Wide Open Insulated Lunch Box with Double Deck Large Capacity Cooler Tote Bag with Removable Shoulder Strap Lunch Organizer for Outdoor/Work(Black),None,4.8 out of 5 stars,411 ratings,None,Cotton,Z+Black,Modern,DTBG,None,Diamond,None,Adult,1139 Cubic Inches, Make sure this fitsby entering your model number.Large Capacity double decks lunch bag:10.5 x 10 x 8.0 inches. Separated exclusive deck design make it keep fresh and hot Simultaneously. You could keep food hot on up deck and keep drinks cool on down deck.So practical independent function to rich your to-go Food for working ; outdoor activity.Wide opening design with long zipperto improve the daily use experiencewe design this wide open easily and quickly put in and take out lunch box or other foods you want from up deck see inside with 100% view never worry about to waste your time to find any small items!Top quality material we choose. To extend the service life we add 8 bronze buckles to firm the handle and double sewing around the connection 5000+ shaking with 20 kg load the handle still works well on limiting conditions. Also we use thickened thermal insulation material to improve the insulated time up to 8 hours!Powerful organization structure.Up deck designed for keeping drinks or fruits; Down deck design for keeping 1-2 lunch boxes large capacity to keep 12+ cans. Front pocket with zipper designed for keeping Knives and forks. Powerful organization ability to carry more foods easily to improve your to-go daily life.Comfortable carrying design. Soft cotton handle provides a cosy taking. Removable shoulder strap help you free your hand when you need.you can take it with to the office go Day Trips Beach Sporting.or pack a healthy snack for your family or have a delightful Sunday picnic.,https://www.amazon.com/Insulated-Capacity-Removable-Shoulder-Organizer/dp/B07QR86PN7/ref=sr_1_44?dchild=1&keywords=Lunch+Bag&qid=1628206630&refinements=p_85%3A2470955011&rnid=2470954011&rps=1&s=home-garden&sr=1-44,,,
Vera Bradley Women's Microfiber Lunch Bunch Lunch Bag,$40.00,4.8 out of 5 stars,395 ratings,In stock soon.,Polyester,Classic Black,Microfiber Lunch Bunch Lunch Bag,Vera Bradley,None,Solid,None,None,None,100% PolyesterImportedMACHINE WASHABLE MICROFIBER -- Made from sleek & lightweight microfiber these solid colors bring style & function to your everyday lifeCHIC & ON-THE-GO -- From picnics in the park to a day at the beach zip up your lunch & a few drinks in the spacious main compartment - keeping you fueled & hydrated all day longQUILTED INSULATION -- Vera Bradley's classic quilted fabric gets an upgrade with an insulated PEVA lined interior & slip pocket for ice packs allowing your food to keep a steady temperature until it's time to eatPUT YOUR NAME ON IT -- Our Lunch Bunch comes with an ID window for you to visibly display your namePERFECTLY SIZED -- The Lunch Bunch measures 9 inches high 8 inches wide & 4 inches deep with a 3 inch handle & an exterior ID window for personalized style & security,https://www.amazon.com/Vera-Bradley-Microfiber-Bunch-Classic/dp/B084DW6NF4/ref=sr_1_45?dchild=1&keywords=Lunch+Bag&qid=1628206630&refinements=p_85%3A2470955011&rnid=2470954011&rps=1&s=home-garden&sr=1-45,,,
Fluf Canvas Lunch Bag | Lunch Box for Men Women & Kids | Organic Cotton Meal Tote with Built-In Handle | Lunch,None,4.8 out of 5 stars,339 ratings,None,Cotton,'LUNCH',None,Fluf,8 x 4.5 x 11 inches,None, 6.4 Ounces,Adult,None, Make sure this fitsby entering your model number.REUSABLE: Intelligently and practically designed for daily use. This cotton canvas bag is effortless to clean pre-shrunk and fully machine washable. Snap closure which is easy for small hands.DURABLE & SPACIOUS: Measuring 11” (h) x 8” (w) x 4.5” (d) this lunch bag is compact yet roomy and flexible enough to accommodate a wide variety of lunch container sizes. It can be folded or squeezed into a tight spot in your backpack or office fridge.WATER RESISTANT LINING: Made with a rinsable tested food-safe lining that works well with an ice pack if desired.ODOR FREE: Rinse the super fast-drying lining in the sink with soap and water and throw the entire bag in the washing machine anytime.HEALTHY & SAFE: Our lunch bags are independently tested and certified to be free of BPA phthalates and heavy metals. The organic cotton exterior is printed with water-based AZO-free inks and the water-resistant lining is tested food-safe.,https://www.amazon.com/Fluf-Organic-Cotton-Lunch-LUNCH/dp/B0049SPBOY/ref=sr_1_46?dchild=1&keywords=Lunch+Bag&qid=1628206630&refinements=p_85%3A2470955011&rnid=2470954011&rps=1&s=home-garden&sr=1-46,,,
adidas Originals Unisex Santiago Insulated Lunch Bag Black ONE SIZE,$25.00,4.8 out of 5 stars,329 ratings,Usually ships within 3 to 5 days.,Mesh,Polyester,Black,Santiago Insulated Lunch Bag,Adidas Originals,None,Solid,None,None,None,100% PolyesterImportedSynthetic liningZipper closureClean with damp cloth as necessaryLined main pocket to keep goods cold.Mesh back for dry items.Lined front pocket.Adidas trefoil logo.Fully padded.,https://www.amazon.com/adidas-Originals-Santiago-Lunch-Black/dp/B077MRPFTF/ref=sr_1_47?dchild=1&keywords=Lunch+Bag&qid=1628206630&refinements=p_85%3A2470955011&rnid=2470954011&rps=1&s=home-garden&sr=1-47,,
