Title,Price,Rating,Review,Availability,Material,Color,Style,Brand,Item Dimension L*W*H,Pattern,Item Weight,Age Range,Capacity,Discription,URL,,,
Swimming Pools Above Ground Pool - 12FT Kiddie Pool with Air Pump Baby Pool Swimming Pool Above Ground Pools for Pools for Kids Pool,None,3.4 out of 5 stars,28 ratings,None,None,Blue,None,EPROSMIN,5.91 x 7.87 x 3.94 inches,None, 26.7 Pounds,None,None, Make sure this fitsby entering your model number.🌈【PERFECT SIZE PLASTIC POOL FOR THE WHOLE FAMILY】The size of our above ground swimming pools is 12FT X 30IN and the pool capacity is 1421gal which can hold 8-10 people perfectly. And above ground pool air pump will be included. (Filter pump is not included)🐳【PROFESSIONAL HIGH QUALITY SWIMMING POOL FOR FAMILY】Our inflatable pool for adults and kids is thicker and more durable than other pool pumps above ground pools. In the event of any leakage please contact us.We have a professional after-sales service team. No worries!🏖【THIS IS A EASY TO INSTALL AND EFFORTLESS OUTDOOR POOL】All you need to do is lay the adults kids swimming pool flat on the floor and then fill the top ring with air. The last step just let the water in blow up pool.The water will prop up the whole backyard pool.🌊【SUPER-TOUGH SIDEWALLS POOLS FOR ADULTS AND KIDS】Our toddler pool/baby pool/kiddie pool is made of high-quality materials which is environmentally friendly and healthier for children. And this big pool won't fade or tear. Easy to fold and stash up for reuse the following summer.🏊‍♂【USE THE WARM REMINDERS OF THE KID POOL】Make sure there are no sharp objects at the bottom to avoid breakages.Try to avoid sun exposure. If there is any problem that is difficult to solve the first step is to contact our after-sales service team.We will respond within 24 hours.,https://www.amazon.com/Swimming-Pools-Above-Ground-Pool/dp/B094983LM1/ref=sr_1_34?dchild=1&keywords=swimming&qid=1628209546&sr=8-34,,,
Speedo Men's Uv Swim Shirt Long Sleeve Loose Fit Easy Tee,$21.02 - $69.91,4.6 out of 5 stars,4967 ratings,None,None,None,None,None,None,None,None,None,None,100% PolyesterImportedHand Wash OnlyUV Block the Burn with UPF 50+ protective fabricDries quicklyLong-sleeve solid loose-fitting swim shirt,https://www.amazon.com/Speedo-Sleeve-Rashguard-Black-X-Large/dp/B005QXF2D6/ref=sr_1_35?dchild=1&keywords=swimming&qid=1628209546&sr=8-35,,,
MP3 Wireless Headphones for Swimming IPX8 Waterproof Earbuds Built-in 8GB Memory & Noise Cancelling Microphone Sports Wearable Music Player Headset for Running Cycling Gym Diving Water Black,None,3.4 out of 5 stars,278 ratings,None,None,Black,None,HPTCCC,None,None,None,None,None, Make sure this fitsby entering your model number.🎶【FULLY SUBMERSIBLE】--The MP3 player headphones is the highest waterproof level (IPX8) that are designed for long period use in water. Designed for sports like swimming running fitness exercise and the like. Note: Bluetooth does not work underwater please switch to MP3 mode and put on waterproof ear caps before swimming.🎶【8GB FLASH MEMORY】--Our Swimming Headphone built-in 8GB memory to stores approximately up to 2400 songs avoid mobile phone in the pocket when you are exercising🎶【QUALITY SOUND】--Innovative aftershocks headphones deliver a premium audio experience delivers a wide dynamic range and rich bass to significantly reduce natural sound leakage you are ensured the best on-the-go audio🎶【BUILT-IN BATTERY】--MP3 player earbuds built-in high-performance 160mAh lithium battery fully charged only 2 hours continuous playback time up to 8H standby time up to 5 days🎶【100% SATISFACTION GUARANTEE】--If you have any questions or hesitation about this swimming headphone please feel free to contact us. We will always be there until your problem has been solved,https://www.amazon.com/Wireless-Headphones-Swimming-Waterproof-Cancelling/dp/B0871VHWJJ/ref=sr_1_36?dchild=1&keywords=swimming&qid=1628209546&sr=8-36,,,
"Inflatable Kiddie Pool 118"" X 72"" X 22"" Full-Size Family Swimming Kids Pool Ball Pit for Kids and Adults Thicken Blow Up Backyard Pool for Toddlers Children Garden Backyard Outdoor",None,4.4 out of 5 stars,385 ratings,None,Polyvinyl Chloride,None,None,Jecoo,None,None,None,None,None," Make sure this fitsby entering your model number.Oversized Kiddie Swimming Pool: Rectangular 118"" X 72"" X 22"" swimming pool can hold 340 gal water capacity and spacious enough to fit a family with 2 adults and 2-4 kids to play in. It’s great for adults and kids relax and enjoy cool summer in the family pool.Thick Durable & Sturdy: Constructed with durable PVC with 0.4mm thickness and equipped with highly sealed valves the inflatable pool can withstand extra weight and prevent leakage.Safe & Secure: Jecoo kiddie inflatable pool meets Children's toy stards (CPSIA  CPC and ASTM certificates). This inflatable pool has a top ring with white cap to reflect the sun's heat so it's safe and great for longer use.Ideal Blow Up Pool: The kids pool is a summer must have for your kid playing in water. It can also be used as a ball pit for toddlers to play in providing you plenty of fun for both indoor and outdoor use.User-Friendly & Easy Set Up: Easy to inflate in 3-5 minutes with the electric pump (not included); Built-in 90° vertical drainpipe can facilitate outflow of water. Convenient to storage if not in use.",https://www.amazon.com/Inflatable-Swimming-Full-Size-Backyard-Toddlers/dp/B08R9TFJVT/ref=sr_1_37?dchild=1&keywords=swimming&qid=1628209546&sr=8-37,,,
Contour Swim Paddles Hand Swim Training Hand Paddles with Adjustable Straps Swimming Hand Paddles for Women and Men,None,4.6 out of 5 stars,707 ratings,None,None,None,None,None,None,None,None,None,None, Make sure this fitsby entering your model number.plasticImportedPremium Quality: The swim hand paddles are made of PC Material they are light weight does not impose an additional burden on swimming. They are durable and not easy to bend feel smooth.Ergonomic Design：Hand paddles with convex design provides increased traction with the water. Hand paddles have many drainage holes and water channels low-impact will allow you to build muscle safely.Adjustable Straps: Straps are made of silicone material they won't hinder the blood flow in palm. The length of the shoulder strap adjusts the palm to the most comfortable state.Various Uses: Help you practice your swimming like freestyle backstroke breaststroke and butterfly. Suitable for swimming beginners to improve swimming skills and enhance arm strength.SantTop Customers Services : If there is any dissatisfaction about the product we promise full refund or a new replacement. Your satisfaction is the greatest affirmation to us!,https://www.amazon.com/Contour-Paddles-Training-Adjustable-Swimming/dp/B07QXSWHF1/ref=sr_1_38?dchild=1&keywords=swimming&qid=1628209546&sr=8-38,,,
Inflatable Swimming Pool 120 x 72 x 22 inches Family Full-Sized Lounge Pool Rectangular Blow Up Pool for Kiddie Toddlers Adults,None,3.8 out of 5 stars,114 ratings,None,Polyvinyl Chloride,Navy Blue,None,Kakashi,None,None,None,None,None, Make sure this fitsby entering your model number.【🐳INFlATABLE SWIMMING POOl】120'' inflatable family lounge pools fits a family with 2 adults and 4 kids to have your own family pool for this summer and enjoy a splashing pool party in your backyard!【🐳Rugged & Stable Structure】3 individual air chambers each with double air intake and free-flow exhaust valve can withstand extra weight while preventing air or water leakage so the outdoor swimming pool is always fun for you.【🐳Durable & Wear-Resistant】Pool made with 0.3mm thickness PVC material the blow up pool is twice thicker than most in the market reducing the risk of punctures.【🐳Easy To Set Up & User-Friendly】Inflate in 3-4 minute by electric pump (not included) equipped with efficient valves that make the portable swimming pool both easy to set up and deflate; 90° vertical drainpipe can facilitate the outflow of water.【🐳Spare & Warranty】Extra repair patch included in the package thus ensuring a long service life.,https://www.amazon.com/Inflatable-Swimming-Full-Sized-Rectangular-Toddlers/dp/B091JV9555/ref=sr_1_39?dchild=1&keywords=swimming&qid=1628209546&sr=8-39,,,
Swimming Ear Plugs 6 Pairs Reusable Silicone Ear Plugs with 6 Pairs Nose Clips Professional Waterproof Fit Ergonomics Gel Ear Protection for Adults and Kids for Showering Bathing Surfing Snorkeling,None,4.2 out of 5 stars,209 ratings,None,None,None,None,MichPong,None,None,None,None,None,【HIGH QUALITY &MULTI-COLOR】Excellent handmade soft materials and exquisite workmanship. This swimming ear plugs are made of high quality smooth soft flexible silicone. A set of swimming earplugs and nose clips with 6 pairs of different colors suitable for different members of the family or 6 colors can be used in rotation. Suitable for swimming surfing shower water skiing canoeing and other water sports.【ERGONOMIC MOLDED DESIGNED】The ergonomic earplugs and nose clips are shaped to fit comfortably inside the ear and nose lie flat on the outer ear making them more comfortable than others. This ensures the safety of the ear and nose is a perfect object to protect the swimmer's ears and nose.【PORTABLE AND REUSABLE】This swimming earplugs are portable with mini size and light weight you could enjoy it at anytime and anywhere. The earplugs and nose clips come with a reusable plastic storage box which you can hold one pair of earplugs and nose clips keeping earplugs and nose clips clean healthy organized and portable.【FIT FOR KIDS AND ADULTS】The ear plugs for swimming greatly suit the shape both of children's and adult's ears and greatly fit in the ears due to the good shape and flexibility allow to deeply penetrate into the ear. With the help of this earplug and nose clips refuse any discomfort.【WONDERFUL BIRTHDAY GIFT】This swimming earplugs are the best gift for adults and kids. Giving this swimming earplugs as a unique present to your loved ones express your love to them and make them feel very special and charming like the star.,https://www.amazon.com/Professional-Waterproof-Ergonomics-Protection-Snorkeling/dp/B08TGSDJM9/ref=sr_1_40?dchild=1&keywords=swimming&qid=1628209546&sr=8-40,,,
2 Pairs Swimmer Ear Plugs Hearprotek Upgraded Custom-fit Water Protection Adult Swimming earplugs for Swimmers Water Pool Shower Bathing and Other Water Sports,None,4.3 out of 5 stars,704 ratings,None,None,Blue,None,Hearprotek,None,None,None,None,None,[KEEPS WATER OUT] With an waterproof mesh layer in the core of each ear plug your ears will be safe from water sound can enter but water cannot. High-quality design you can use these earplugs not just to swimming but also for showering bathing and kayaking. It is the perfect earplugs to prevent swimmer's ear in the long run.[ERGONOMIC DESIGN] Double flanges keeps water out. Made from soft silicone bud earplugs are so comfortable that you'll quickly forget you're even wearing them. Their contoured shape is designed to fit perfectly into the ear and prevent seepage.[CUSTOM FIT FOR OPTIMAL COMFORT] Three sizes of securing wings for custom fit keeps your plugs in place. And the contoured design offer a more locked-in fit to ensure that it doesn’t fall out of your ears when playing in the water. You can also customize these earplugs to your liking.[EASY CARRYING] Each pack includes two reusable pairs with their own case which keeps them safe and clean when not in use. A selection of 2 bright colors are available so if they dropped into the water you will never lose them. They are very stylish assuming you like the color![FULLY REUSABLE & WASHABLE] These silicone ear plugs are your best value for they’re reusable over and over again rather than throwing them out each time for a new pair! Use it while you do your exercise and plug out wash them and keep in the protective.,https://www.amazon.com/Hearprotek-Upgraded-Custom-fit-Protection-Swimming/dp/B08FRKJG5M/ref=sr_1_41?dchild=1&keywords=swimming&qid=1628209546&sr=8-41,,,
Swimming (Merit Badge Series),None,4.0 out of 5 stars,1 rating,None,None,None,None,None,None,None,None,None,None,None,https://www.amazon.com/Swimming-Merit-Badge-Series/dp/B0072ZCJ5U/ref=sr_1_42?dchild=1&keywords=swimming&qid=1628209546&sr=8-42,,,
"Inflatable Swimming Pool-120"" X 69"" X 22"" Kiddie Pool for Adults Kids Baby-10 ft Blow up Full-Sized Family Pool-Above Ground Swimming Pool for Backyard Outdoor Indoor Lounge Garden",None,4.6 out of 5 stars,24 ratings,None,Polyvinyl Chloride,Blue,None,Tongtai,None,None,None,None,None, Make sure this fitsby entering your model number.【Family Inflatable Swimming Pool】Size: 120 X 69 X 22 inch it can hold up to 5-7 people(Recommended age: 12+) so you can enjoy a splashing pool party in the backyard! Also it can be easily turned into an indoor ball pool with plenty of fun for both indoor and outdoor use.【Durable and Anti-UV Protection for Longer Use】After a long-term investigation we found that most of the swimming pools are easy to break and leak. We thickened the pool(0.5mm thick/20.3 pounds weight)in order to avoid the risk of puncture and ensure a longer life and made of long-lasting anti-UV material is capable of blocking out harmful UVA and UVB solar rays making it safe to use under the sun.【Material safety】Made of the latest upgraded PVC material (Lead Free BPA-free Non-toxic Durable Anti-aging) and have CPSIA and CPC certificates.【Quick and Easy】The swimming pool with 3 individual air chambers inflate or deflate in 3-5 minute by electric pump. Have drain hole on the bottom to easily drain water out.【100% Satisfaction After-sales】Repair patch included which can take care of your pool and will last a long time. If you have any questions or dissatisfaction with the product please feel free to contact us we will do our best to help you.,https://www.amazon.com/Inflatable-Swimming-Pool-120-Full-Sized-Pool-Above/dp/B08ZS2594N/ref=sr_1_43?dchild=1&keywords=swimming&qid=1628209546&sr=8-43,,,
Kanu Surf Men's Infinite Swim Trunks (Regular & Extended Sizes),$18.93 - $24.99,4.6 out of 5 stars,9945 ratings,None,None,None,None,None,None,None,None,None,None,100% PolyesterImportedElastic closureMachine WashUPF 50+ quick dry microfiber: Lightweight and durable for your most comfortable pair of swim trunks for the beach pool or just lounging aroundTriple needle side seams and rises make Kanu Surf swimming trunks and bathing suits among the highest quality you will ownSide seam pockets and cargo pockets give plenty of options for storageComfortable mesh liningFull elastic waist and drawstring closure: Kanu Surf swimwear fits true to size,https://www.amazon.com/Kanu-Surf-Regular-Extended-X-Large/dp/B07KQPS221/ref=sr_1_44?dchild=1&keywords=swimming&qid=1628209546&sr=8-44,,,
2021NEW Water Gun for Kids 1000CC Squirt Gun for Kids 2 Pack Water Guns for Kids Water Blasters Squirt Guns for Kids Water Squirt Guns for Adults Watergun for Swimming Pool Beach Sand Play Gifts,None,4.5 out of 5 stars,65 ratings,None,Plastic,None,None,SHSTFD,None,None,None,None,None, Make sure this fitsby entering your model number.【2021NEW Water Pistol】The cover of the water squirter is equipped with a soft cushion to prevent water leakage. Sliding the pump handle forward and pull it back to squirt water can avoid pain from pulling the trigger. Clever leaking air hole increases the range to 30 feet. Enjoy your summer water fun with the new style waterguns.【Durable and Easy to Use】The water guns for adults is made of ABS plastic strong and durable. Push the pump head forward and backward and shoot easily! Perfect for kids ages 3+ for having water fun! The tank has a large capacity of 1000cc so you don't need to fill water frequently. The large water inlet is convenient for you to fill water quickly.【Super Value Outdoor Water Toys】One purchase you can get two water guns open the package immediately after you can enjoy the fun of playing with water! Perfect for summer water fighting family water Fun swimming pool and outdoor toys summer gift for kids. Bring the water blasters for kids home and add fun to your summer!【Cool Design】The squirt gun is designed to resemble the squirt guns hero used in cartoons and video games. You kids will look like cartoon hero when play with it. The water guns for kids ages 4-8 can shine your neighborhood kids when your kids using it. Just pump to shoot after filling clean water. Be careful not to aim the squirt at eyes.【Worry-Free Guarantee】We use a scientific manufacturing process and strict quality control system to provide you with high quality water gun. If you are not satisfied with the squirt gun please feel free to contact us within 30 days you will get a hassle-free full refund.,https://www.amazon.com/2021NEW-1000CC-Blasters-Watergun-Swimming/dp/B08Z7XPLXP/ref=sr_1_45?dchild=1&keywords=swimming&qid=1628209546&sr=8-45,,,
speedo Women's Swimsuit One Piece PowerFlex Princess Seam Ultraback Conservative Cut,$34.91 - $73.59,4.4 out of 5 stars,2886 ratings,None,None,None,None,None,None,None,None,None,None,ULTRA DURABLE: PowerFlex fabric lasts 5-10x longer than ordinary spandexFASTER MUSCLE RECOVERY: Compression technology increases circulation for faster muscle recovery and chafe-free movementCHLORINE-RESISTANT: Resists fading sagging and baggingNO SLIPS: Lotion and oil resistant material for stay-put coverageBUST SUPPORT: Built-in medium bust support and cups comfortably hold you in for less bounce and more coverageULTRA BACK: Great range of motion with a strap design that supports and stays in placeCONSERVATIVE CUT: Lowest leg cut for more coverageMATERIAL: 76% Nylon / 24% Spandex,https://www.amazon.com/Speedo-Plus-Size-Powerflex-Conservative-Ultraback/dp/B009T2PRWQ/ref=sr_1_46?dchild=1&keywords=swimming&qid=1628209546&sr=8-46,,,
LimitlessXme Swim Buoy & Drybag - for Swimmers Open Water and Triathlon. Pull Buoy for Adults and Kids. Orange Signal Swimming Bubble,None,4.6 out of 5 stars,230 ratings,None,None,None,None,None,None,None,None,None,None, Make sure this fitsby entering your model number.VISIBILITY: Increased visibility through bright colour. As swimmers we are very difficult to see in open water for boats jetskis... - the buoy increases visibility due to the bright color and large surface area. It also offers the possibility to rest at the buoy.BUOY INCLUDING DRY BAG: The buoy consists of an inflatable chamber and a dry bag of approximately the same size (drysack wet bag) which offers enough space for towel T-shirt etc.SET-OFFER: The set consists of the inflatable buoy with large separate dry bag chamber PLUS waterproof mobile phone cover.LIGHT AND SMALL PACK SIZE: The buoy is super light and can be folded to a very small packing size. So it fits very well in every bag.SATISFACTION GUARANTEED: No marketing Bah-Blah - you should have a lifetime of fun with the buoy. We try everything in the production so that we can put a long-lasting product in your hands. From time to time something still goes wrong. Contact us us at any time if something doesn't work. We will replace the buoy without discussion within 12 months. In addition we will repair it for a lifetime if something breaks.,https://www.amazon.com/LimitlessXme-Swim-Buoy-Drybag-Triathlon/dp/B082S2CBRV/ref=sr_1_47?dchild=1&keywords=swimming&qid=1628209546&sr=8-47,,,
Zooshine Silicone Waterproof Swimming Nose Clips Pool Nose Plugs for Adults with Box Packed Set of 4,None,4.2 out of 5 stars,73 ratings,None,None,None,None,None,None,None,None,None,None, Make sure this fitsby entering your model number.Protect Nose--- It keeps your nose dry don't worry about water entering your nose.Box Packed--- Keep the nose clips portableclean and organized.Stable and Comfortable--- Dotted design makes the nose clip more stable on nose;It made of soft siliconenever worry about hurting your nose when use it.Suitable for Most--- The nose clips can work very well for children 10+ and adults.Tips: Before use the nose clipplease clean oil on nose.,https://www.amazon.com/Zooshine-Silicone-Waterproof-Swimming-Adults/dp/B08ZSC86ZC/ref=sr_1_49?dchild=1&keywords=swimming&qid=1628209546&sr=8-49,,,
CAPAS Snorkel Fins Swim Fins Travel Size Short Adjustable for Snorkeling Diving Adult Men Women Kids Open Heel Swimming Flippers,None,4.5 out of 5 stars,3981 ratings,None,None,None,None,None,None,None,None,None,None,Adjustable Open Heel Design Good for Sharing - The open-heel design means each fin can accommodate a wider range of sizes so family members or friends can share equipment more easily. The best parts is the filter pads inside the fins can keep fins in shape when store it.Wears Comfortably Support Various Way to Put On - Carefully select high quality material soft foot pocket flexible enough for barefoot but can also be worn with fin socks or dive booties which help to protect a diver's feet from the cold and blisters. (Reminder: Please purchase sizes up if wear with dive booties together)Compact Size Perfect for Travelling - This short fins is an excellent choice for avid travelers as the short blade is lightweight and compact making it ideal for packing with ease. And it is a useful swimming aid either for pool or sea swim-lovers or snorkelers.Quick and Easy to Try it On and Adjust Size Up or Down - Soft heel straps with large thumb loops giving you easy one-time adjustment and allowing you to easily put on and remove the fins.Kids and Adults Size - 3 unisex size choice for Kids Children Teens Young Adults Adults(women men). Generally kid’s US Standard Size 9-13 should pick size Kids JR 9-13 S/MD Young Adults or Adults whose size is between 4.5-8.5 should pick size S/M and the size between 9-13 should pick L/XL. Just take the fins and enjoying your snorkeling or swimming.,https://www.amazon.com/CAPAS-Adjustable-Snorkeling-Swimming-Flippers/dp/B0896VH12W/ref=sr_1_50?dchild=1&keywords=swimming&qid=1628209546&sr=8-50,,,
Womens Swim Cap for Long Hair High Elasticity Thick Silicone Swimming Hats for Women Men Unisex Adults Bathing Swimming Caps with Ear Plugs and Nose Clip Keep Your Hair Dry,None,4.4 out of 5 stars,873 ratings,None,None,None,None,None,None,None,None,None,None, Make sure this fitsby entering your model number.Premium & Sturdy & Thicker Silicone: Alepo swim cap is made from high-quality eco-friendly silicone material which features durable tear-resistant and waterproof. Great elasticity makes it stretch easily no deformation after repeated use. The silicone material is also odorless non-toxic skin-friendly safe to use give your best protection when swimming.Unisex for Short/Long Hair: Created with great elasticity and large room Alepo silicone swim cap is flexible enough to fit most size heads including men women boys girls adults child and kids with short or long hair. It can accommodate and protect your hair from chlorine salt water keep your hair lock secure and tangle-free when swimming!Upgraded Ear Protection: Earplugs and nose clip set have included which can prevent water from entering the nose and ears canal in maximum way and protect ears against infection from bacteria and fungi. We also extend the swim cap in ear part covering adding an extra layer of protection for ears and helps keep earplugs in place let you focus on your swimming.Perfect Ergonomic Design: Alepo swimming cap is mainly designed in the shape of a human skull which makes a more comfortable fit for most people and easy to take on/off without snagging your hair. Good streamline also helps you swim faster with less water resistance enjoy a professional swimming experience.Various Colors Great Choice: With fashionable concise design top-class quality and various colors Alepo swim caps can meet all people's needs suit most people's choices. Nice swimming cap selection for swimming lovers!,https://www.amazon.com/Alepo-Protection-Thicker-Silicone-Swimming/dp/B085G7R8XV/ref=sr_1_51?dchild=1&keywords=swimming&qid=1628209546&sr=8-51,,,
Kanu Surf Men's Cb Rashguard UPF 50+ Swim Shirts (Regular & Extended Sizes),$18.01 - $28.50,4.5 out of 5 stars,12277 ratings,None,None,None,None,None,None,None,None,None,None,100% PolyesterImportedMachine WashShort-sleeve rashguard featuring crew neckline and contrast panels at sidesUPF 50+ rating,https://www.amazon.com/Kanu-Surf-Rashguard-Charcoal-XX-Large/dp/B00FQE3YYY/ref=sr_1_52?dchild=1&keywords=swimming&qid=1628209546&sr=8-52,,,
Handbags for Women Shoulder Bags Tote Satchel Hobo 3pcs Purse Set,None,4.6 out of 5 stars,21674 ratings,None,None,None,None,None,None,None,None,None,None,"Great quality materialSuper cute and perfect size.Well made and very sturdy - Made of synthetic leather.The stitching is well-made as runs smoothly and evenlyfeels cosy to touch.Highly anti-scratch and tear-resistantnot easy to be out of shapeSpecial Design-Tote bag: The top zipper is smooth and easy to open and close; Medium crossbody bag with tassel: Zipper closure & front zipper is a functional pocketAdjustable long shoulder strapRoomy - Big Tote/Messenger Bag:The inside has one main compartment1 zipper pocket and 2 slot pockets.One more extra wallet clutchconvenient to carry withPractical Use - 3 In 1.Perfect to wear on many occasions.Fashion and Casual Style.You can use it when going outshoppingtraveling or go to partiesDimension - Shoulder Bag Size : 11.8"" x 10.4"" x 4.7""(W x H x D) Strap Height:9.8"" Crossbody Bag:10.6"" x8.3"" x 4.1""(W x H x D) Wallet Clutch:7.1"" x 5.5 x 2.4""(W x H x D)",https://www.amazon.com/Handbags-Women-Shoulder-Satchel-Apricot/dp/B07VPMJ4QH/ref=sr_1_1?dchild=1&keywords=women+bags&qid=1628210174&sr=8-1,,,
